message_id,date,sender_id,first_name,last_name,username,message,reply_to
10678,2025-04-23 10:13:53,-1001285840493,,,,OBV,
10677,2025-04-23 10:13:40,-1001285840493,,,,,
10676,2025-04-23 00:19:29,-1001285840493,,,,100% of our Bitcoin buys are in profit again. Some almost 30x.,
10675,2025-04-23 00:18:24,-1001285840493,,,,"Big short term resistance hit, while big players keep buying passively, but some are taking profit slowly too.

Large support now materialized in OBs around 87.5k.

Remains to be seen if spoof or real.

I read as follow:

Long term players back accumulating strong.
Short term players distributing profit from last low buys.

Expecting more volatility.",
10674,2025-04-23 00:16:26,-1001285840493,,,,,
10673,2025-04-23 00:14:01,-1001285840493,,,,"Now, for what it's worth:",
10672,2025-04-23 00:11:05,-1001285840493,,,,.,10485
10671,2025-04-23 00:10:55,-1001285840493,,,,.,10478
10670,2025-04-23 00:10:43,-1001285840493,,,,.,10470
10669,2025-04-23 00:10:20,-1001285840493,,,,.,10518
10668,2025-04-23 00:10:01,-1001285840493,,,,"Leave your ego on the side. 

Follow the rules.",
10667,2025-04-23 00:09:46,-1001285840493,,,,"Please focus on what I'm telling you. 

This game is easy.

I give you all you need and many still fail.

If you fail, you're the problem.",
10666,2025-04-23 00:09:06,-1001285840493,,,,"Also, regarding Neiro, I already said I won't talk about it anymore. This is a fight I decided to pick. The day I win you will know. Stay out of it unless you followed it back then. It's not a good time to enter anymore.",
10665,2025-04-23 00:05:08,-1001285840493,,,,"A few weeks ago everyone was expecting a crypto apocalypse.

I was telling you whales were buying, and I was accumulating.

Many freaked out and many capitulated.

I was telling you to keep your eyes on the chart the next few weeks.

What now?

When will you learn?",
10664,2025-04-23 00:01:48,-1001285840493,,,,"Since then I repeated a trillion time:

Never leverage.
Never sell your BTC.
Always have most of your wealth in BTC.
Never put more than a few % of your BR in another coin.
Inject profit back in BTC.

All you had to do is follow the rules.
You would be so rich.

Guess what, you can still follow them.

BTC
+ SDEX 
+ LINK
+ ETH

That's the play for now.

I called $120k BTC when it was 4k.

Everyone I knew laughed at my post.

Then we bought it back at these levels in March 2020.

Those who lived the moment will never forget.

What if I told you, you can still follow the rules?

And in a few years you will look back at today with the same smile we look back at 2019?

Embrace the vol. and have fun, we are going to make it.",
10663,2025-04-22 23:57:44,-1001285840493,,,,"Guess what, I changed my mind.

We will never be selling BTC, period.",
10662,2025-04-22 23:57:16,-1001285840493,,,,"BTC was at $4k back then.

Funny days.",1173
10661,2025-04-22 16:23:04,-1001285840493,,,,🥱,10648
10660,2025-04-21 00:35:47,-1001285840493,,,,That's all that was required of you.,
10659,2025-04-21 00:31:01,-1001285840493,,,,All you had to do is follow the rules.,
10658,2025-04-14 14:52:01,-1001285840493,,,,Learn from it.,
10657,2025-04-14 14:51:16,-1001285840493,,,,Take a few minutes to reflect back on how panicked you were just a few days ago.,
10656,2025-04-08 17:48:58,-1001285840493,,,,"If you can't understand volatility is the price you pay for building wealth, you're living in a world of fantasies.",
10655,2025-04-08 17:48:38,-1001285840493,,,,"Elon Musk, Jeff Bezos and Zuckerberg lost hundreds of billions of dollars in a few weeks. They more than halved their wealth. Do they care? No. They are richer than 3 years ago. Lot richer than 5 years ago. An order of magnitude richer than 10 years ago.",
10654,2025-04-08 17:45:48,-1001285840493,,,,Why the fuck would you care what happens? It's noise. Just noise. Keep your eyes on the signal.,
10653,2025-04-08 17:45:12,-1001285840493,,,,"If you learn this, you're still in large profit right now compared to two years ago, or 4 years ago, or 6 years ago. All you need is do what I do.",
10652,2025-04-08 17:44:21,-1001285840493,,,,Forget about everything else.,
10651,2025-04-08 17:44:14,-1001285840493,,,,"All you need, and I insist, all you need, is to understand each of these words entirely. Not have an idea of what they are. Understand. Actually do.",
10650,2025-04-08 17:43:45,-1001285840493,,,,"You will always, always make money. For the rest of your life.",
10649,2025-04-08 17:43:36,-1001285840493,,,,"Sincerely. The very best thing you can do, is learn about outcome expectation, variance, EV, noise to signal ratios and probability distributions.",
10648,2025-04-08 17:41:28,-1001285840493,,,,People selling here will look very stupid in retrospect.,
10647,2025-04-06 22:54:56,-1001285840493,,,,"When you start hearing ""x exchange halts trading"" you know the FED will not be far.",
10646,2025-04-06 22:53:12,-1001285840493,,,,These are very rare events.,
10645,2025-04-06 22:52:56,-1001285840493,,,,"Liquidations everywhere.

Some guy just had to liquidate 102 BTC from margin.",
10644,2025-04-06 21:13:07,-1001285840493,,,,Once again.,
10643,2025-04-06 21:12:54,-1001285840493,,,,,
10642,2025-04-06 21:12:16,-1001285840493,,,,"This situation looks dire now, but it won't last forever. Once the Fed is forced to step in, things will shift quickly. The current environment is separating the tourists from the true believers.",
10641,2025-04-06 21:11:54,-1001285840493,,,,"Bitcoin's ""store of value"" narrative is strengthening, not weakening. Remember last cycles? Every single time market crashed and BTC was going down, the ""store of value"" idea was mocked. Now it's happening.",
10640,2025-04-06 21:11:31,-1001285840493,,,,Market structure resets after liquidations typically lead to strong reversals.,
10639,2025-04-06 21:11:19,-1001285840493,,,,But: the Fed will eventually be forced to step in with aggressive rate cuts.,
10638,2025-04-06 21:10:57,-1001285840493,,,,"So, you should know that volatility is still expected short term.",
10637,2025-04-06 21:10:43,-1001285840493,,,,What happened on the FED switch? Bitcoin exploded everything.,
10636,2025-04-06 21:10:31,-1001285840493,,,,"Bitcoin crashed 50% in a single day (from $8,000 to $3,800), $700M+ in liquidations on BitMEX alone that day. All markets were dying.",
10635,2025-04-06 21:10:10,-1001285840493,,,,Remember March 2020.,
10634,2025-04-06 21:09:56,-1001285840493,,,,"Institutional buyers scooping up discounts, ""Smart money"" viewing this as an opportunity, long-term Bitcoin macro investors stacking.",
10633,2025-04-06 21:09:31,-1001285840493,,,,At the same time:,
10632,2025-04-06 21:09:21,-1001285840493,,,,Leveraged traders getting liquidated. Margin calls forcing selling across all asset classes.,
10631,2025-04-06 21:09:08,-1001285840493,,,,"Bitcoin is increasingly viewed as a ""blue-chip"" investment within the crypto space, with the strongest liquidity and market capitalization. The market structure has fundamentally changed since spot ETFs launched, bringing in retirement accounts, macro funds, and corporate treasuries. That makes vol go down. But altcoins still are considered highly speculative risk-on assets.",
10630,2025-04-06 21:08:27,-1001285840493,,,,"Institutional investors and ""smart money"" accumulating like never before, confirmed both by my quant tools on CEXs and by on-chain activity (see Arkham).",
10629,2025-04-06 21:08:10,-1001285840493,,,,"""Decoupling"" from stock market correlation means something weird is going on, a paradigm shift.",
10628,2025-04-06 21:07:52,-1001285840493,,,,Bitcoin has demonstrated remarkable resilience. Holding better than most dominating indexes on the planet.,
10627,2025-04-06 21:07:36,-1001285840493,,,,"Former IMF chief economist Blanchard: ""The recession will dominate whatever inflation concerns may arise"".",
10626,2025-04-06 21:07:23,-1001285840493,,,,Bank of England likely to deliver three cuts this year too.,
10625,2025-04-06 21:07:17,-1001285840493,,,,ECB expected to cut rates in both April and June.,
10624,2025-04-06 21:07:09,-1001285840493,,,,"Before last Trump funny announcements, it was 1 or maybe 2.",
10623,2025-04-06 21:06:49,-1001285840493,,,,Markets are now pricing in 85% chance of MORE THAN THREE rate cuts by year-end,
10622,2025-04-06 21:06:23,-1001285840493,,,,Fed has an impossible dilemma:,
10621,2025-04-06 21:06:14,-1001285840493,,,,"Disruption in global supply chain is expected, like during COVID because of tariffs",
10620,2025-04-06 21:05:44,-1001285840493,,,,"Not just a correction, the biggest crash, absolutely value destroying event since 5 years (march 2020)",
10619,2025-04-06 21:05:28,-1001285840493,,,,"S&P 500 down, DJ down, Nasdaq down, global markets melting",
10618,2025-04-06 20:46:17,-1001285840493,,,,Thanks.,
10617,2025-04-06 20:46:06,-1001285840493,,,,Closing polls.,
10616,2025-04-06 20:37:37,-1001285840493,,,,,
10615,2025-04-06 20:36:28,-1001285840493,,,,,
10614,2025-04-06 18:54:53,-1001285840493,,,,And we're still higher than March 11.,
10613,2025-04-06 18:54:25,-1001285840493,,,,Big players are buying more right now at this very minute than they've been on March 11 and for the past 5 months.,
10612,2025-04-06 18:50:12,-1001285840493,,,,Breathe. 😉,
10611,2025-04-05 15:46:47,-1001285840493,,,,,
10610,2025-04-04 21:51:38,-1001285840493,,,,Back to neutral.,
10609,2025-04-04 21:51:34,-1001285840493,,,,"Profit taking by MMs, done.",
10608,2025-04-04 17:56:38,-1001285840493,,,,,10527
10606,2025-04-04 17:53:35,-1001285840493,,,,,10509
10605,2025-04-04 17:53:02,-1001285840493,,,,This moment will be remembered in this channel for years and you will realize it too late.,10524
10604,2025-04-04 17:44:42,-1001285840493,,,,Expect resistance under 85k for a while.,
10603,2025-04-04 17:44:18,-1001285840493,,,,"Not fully yet, but on their way. Distributing.",
10602,2025-04-04 17:43:35,-1001285840493,,,,"All the 82k shorts got killed, all the 82k longs are taking profit on these longs now.

Market Makers going back to neutral.",10574
10601,2025-04-04 15:02:50,-1001285840493,,,,Like your average sorority girl.,
10600,2025-04-04 15:02:25,-1001285840493,,,,"Also, right now big players are swallowing all the BTC.",
10599,2025-04-04 15:02:05,-1001285840493,,,,If candle closes green it's canceled tho.,
10598,2025-04-04 15:01:53,-1001285840493,,,,,
10597,2025-04-04 15:01:44,-1001285840493,,,,OBV never lies and right now it's on the verge of becoming ugly.,
10596,2025-04-04 15:01:14,-1001285840493,,,,Two things at once.,
10595,2025-04-04 14:55:09,-1001285840493,,,,,
10594,2025-04-03 21:07:59,-1001285840493,,,,😂,
10593,2025-04-03 21:07:52,-1001285840493,,,,Ngl I will create a website to sell access to a few tools I developed at $999 a month and allow serious people to have x-ray vision on what the market is doing and never trade against big players ever again and donate all profit to child education,
10592,2025-04-03 21:00:52,-1001285840493,,,,You can see it straight in the orderbooks with the perfect tools.,
10591,2025-04-03 21:00:45,-1001285840493,,,,And you don't even need to read the blockchain.,
10590,2025-04-03 21:00:40,-1001285840493,,,,Maybe someone that watches what big players do.,
10589,2025-04-03 21:00:25,-1001285840493,,,,WHO WOULD HAVE GUESSED,
10588,2025-04-03 21:00:21,-1001285840493,,,,OH LOOK,
10587,2025-04-03 21:00:19,-1001285840493,,,,https://x.com/arkham/status/1907879130974028005,
10586,2025-04-03 20:25:46,-1001285840493,,,,"Maybe we'll go lower.

But if we do, a lot of very rich people are going to lose money very quickly.

So even if it can happen... keep that in mind.",
10585,2025-04-03 20:24:49,-1001285840493,,,,,
10584,2025-04-03 16:13:18,-1001285840493,,,,MMs still buying (less).,
10583,2025-04-03 13:09:01,-1001285840493,,,,MMs still buying.,
10582,2025-04-03 11:49:46,-1001285840493,,,,MMs still buying.,
10581,2025-04-03 02:33:40,-1001285840493,,,,"Gtg now. MMs still buying. 

Idk for how long. Careful out there.",
10580,2025-04-03 00:13:14,-1001285840493,,,,"Guess what, we will likely kill the late shorters and then they will go back to neutral.",
10579,2025-04-03 00:12:09,-1001285840493,,,,,
10578,2025-04-03 00:05:54,-1001285840493,,,,Wouldn't surprise me if we destroy the late shorts now.,
10577,2025-04-03 00:05:37,-1001285840493,,,,Market Makers still buying hard here.,
10576,2025-04-03 00:03:24,-1001285840493,,,,"-7% since daily high.

This market is made to destroy traders and reward holders.

Be wise! You don't need to make it painful.",
10575,2025-04-02 23:09:54,-1001285840493,,,,😂,
10574,2025-04-02 23:09:25,-1001285840493,,,,Many shorters entering here at 82k.,
10573,2025-04-02 22:55:23,-1001285840493,,,,Always the same story.,
10572,2025-04-02 22:55:13,-1001285840493,,,,"Market Makers buying big again, while you freak out.",
10571,2025-04-02 20:31:25,-1001285840493,,,,Noobs are on the wrong side of the trade every single time.,
10570,2025-04-02 20:31:00,-1001285840493,,,,"OK now watch, we flushed all the leveraged late longs. And now Market Makers are buying again.",
10569,2025-04-02 15:43:26,-1001285840493,,,,You would be able to see everything.,
10568,2025-04-02 15:43:19,-1001285840493,,,,I shall give you access to my tools one day.,
10567,2025-04-02 15:43:06,-1001285840493,,,,Always the same game.,
10566,2025-04-02 15:42:57,-1001285840493,,,,Of these past 5 days where everyone was panicked while they were buying.,
10565,2025-04-02 15:42:31,-1001285840493,,,,Market Makers taking heavy profit right now.,
10564,2025-04-02 15:41:46,-1001285840493,,,,And now people will buy the top of the day.,
10563,2025-04-02 15:41:23,-1001285840493,,,,This will never not be funny.,
10562,2025-04-02 15:41:16,-1001285840493,,,,And just like that the past 5 bearish days are forgotten.,
10561,2025-03-31 10:41:40,-1001285840493,,,,Whales still absorbing this.,
10560,2025-03-29 17:30:27,-1001285840493,,,,"Baby, wake up! Larry Fink is again swallowing up the Bitcoin of idiots.",
10559,2025-03-29 17:17:23,-1001285840493,,,,,
10558,2025-03-29 17:17:18,-1001285840493,,,,Current state of things,
10557,2025-03-29 12:51:46,-1001285840493,,,,Market Makers buying again.,
10556,2025-03-29 02:21:34,-1001285840493,,,,Market Makers back to neutral.,
10555,2025-03-28 14:52:50,-1001285840493,,,,Market Makers are buying.,
10554,2025-03-28 14:52:32,-1001285840493,,,,Be not afraid yet. OBV signals manipulation for now.,
10553,2025-03-28 14:49:47,-1001285840493,,,,Accelerating.,
10552,2025-03-28 14:38:22,-1001285840493,,,,Some entity dumping 5 BTC every 10 seconds (twap) for the past hour.,
