message_id,date,sender_id,first_name,last_name,username,message,reply_to
13389,2025-04-22 16:29:54,-1001407364023,,,,How many of you are interested for Online Batch as well. Please let me know I will definitely think on same,
13388,2025-04-22 12:44:04,-1001407364023,,,,"NEW OFFLINE BATCH FOR ONLY QUANT - Upcoming Banking Exams like IBPS RRB PO / IBPS PO / SBI PO 

STARTING FROM 28th April 

Timings - 7.30 am 

Share with your friends if anyone in pune or wants to come Pune for offline classes.",
