[
    {
        "message_id": 29538,
        "date": "2025-04-24 12:21:14",
        "sender_id": -1001484150043,
        "first_name": null,
        "last_name": null,
        "username": null,
        "message": "",
        "reply_to": null
    },
    {
        "message_id": 29537,
        "date": "2025-04-24 12:21:13",
        "sender_id": -1001484150043,
        "first_name": null,
        "last_name": null,
        "username": null,
        "message": "",
        "reply_to": null
    },
    {
        "message_id": 29536,
        "date": "2025-04-24 12:21:13",
        "sender_id": -1001484150043,
        "first_name": null,
        "last_name": null,
        "username": null,
        "message": "23.04.2025 Netherlands ğŸ‡³ğŸ‡±\nGo Ahead Eagles player Victor Edvardsen with pyro after winning the cup Final",
        "reply_to": null
    },
    {
        "message_id": 29535,
        "date": "2025-04-24 11:14:37",
        "sender_id": -1001484150043,
        "first_name": null,
        "last_name": null,
        "username": null,
        "message": "9 years agoâš ï¸\n24.04.2016 Arrange fight, Lithuania.\nLegia Warszawa, whiteğŸ‡µğŸ‡± vs School + Avantgarde + The Aliens + Wild Boars + Boxer Gang (Spartak Moscow, yellow ğŸ‡·ğŸ‡º). 63x63. 1,30 min. Win. Spartak Moscow",
        "reply_to": null
    },
    {
        "message_id": 29533,
        "date": "2025-04-24 08:25:06",
        "sender_id": -1001484150043,
        "first_name": null,
        "last_name": null,
        "username": null,
        "message": "XX.04.2025 PolandğŸ‡µğŸ‡± Arrange fight, U23. ChWM (Lechia GdaÅ„sk) vs KKS Kalisz. 13x13. 1 min. Win. Lechia GdaÅ„sk",
        "reply_to": null
    },
    {
        "message_id": 29532,
        "date": "2025-04-24 05:00:39",
        "sender_id": -1001484150043,
        "first_name": null,
        "last_name": null,
        "username": null,
        "message": "",
        "reply_to": null
    },
    {
        "message_id": 29531,
        "date": "2025-04-24 05:00:39",
        "sender_id": -1001484150043,
        "first_name": null,
        "last_name": null,
        "username": null,
        "message": "",
        "reply_to": null
    },
    {
        "message_id": 29530,
        "date": "2025-04-24 05:00:38",
        "sender_id": -1001484150043,
        "first_name": null,
        "last_name": null,
        "username": null,
        "message": "",
        "reply_to": null
    },
    {
        "message_id": 29529,
        "date": "2025-04-24 05:00:38",
        "sender_id": -1001484150043,
        "first_name": null,
        "last_name": null,
        "username": null,
        "message": "",
        "reply_to": null
    },
    {
        "message_id": 29528,
        "date": "2025-04-24 05:00:38",
        "sender_id": -1001484150043,
        "first_name": null,
        "last_name": null,
        "username": null,
        "message": "20.04.2025 Germany ğŸ‡©ğŸ‡ª\nEintracht Frankfurt away against Augsburg",
        "reply_to": null
    },
    {
        "message_id": 29527,
        "date": "2025-04-23 21:17:56",
        "sender_id": -1001484150043,
        "first_name": null,
        "last_name": null,
        "username": null,
        "message": "",
        "reply_to": null
    },
    {
        "message_id": 29526,
        "date": "2025-04-23 21:17:55",
        "sender_id": -1001484150043,
        "first_name": null,
        "last_name": null,
        "username": null,
        "message": "23.04.2025 Austria ğŸ‡¦ğŸ‡¹ \npyro Austria Wien today  home against Sturm Graz",
        "reply_to": null
    },
    {
        "message_id": 29524,
        "date": "2025-04-23 20:32:27",
        "sender_id": -1001484150043,
        "first_name": null,
        "last_name": null,
        "username": null,
        "message": "",
        "reply_to": null
    },
    {
        "message_id": 29523,
        "date": "2025-04-23 20:32:27",
        "sender_id": -1001484150043,
        "first_name": null,
        "last_name": null,
        "username": null,
        "message": "23.04.2025 Italy ğŸ‡®ğŸ‡¹\nGenoa against Lazio. Protest of the ultras of Genoa against modern football. in particular because after the death of the pope crazy decisions were made to the detriment of the fans.",
        "reply_to": null
    },
    {
        "message_id": 29522,
        "date": "2025-04-23 19:56:55",
        "sender_id": -1001484150043,
        "first_name": null,
        "last_name": null,
        "username": null,
        "message": "23.04.2025 Austria ğŸ‡¦ğŸ‡¹ \nSturm Graz away against Austria Wien",
        "reply_to": null
    },
    {
        "message_id": 29521,
        "date": "2025-04-23 19:49:51",
        "sender_id": -1001484150043,
        "first_name": null,
        "last_name": null,
        "username": null,
        "message": "",
        "reply_to": null
    },
    {
        "message_id": 29520,
        "date": "2025-04-23 19:49:51",
        "sender_id": -1001484150043,
        "first_name": null,
        "last_name": null,
        "username": null,
        "message": "",
        "reply_to": null
    },
    {
        "message_id": 29519,
        "date": "2025-04-23 19:49:50",
        "sender_id": -1001484150043,
        "first_name": null,
        "last_name": null,
        "username": null,
        "message": "",
        "reply_to": null
    },
    {
        "message_id": 29518,
        "date": "2025-04-23 19:49:50",
        "sender_id": -1001484150043,
        "first_name": null,
        "last_name": null,
        "username": null,
        "message": "",
        "reply_to": null
    },
    {
        "message_id": 29517,
        "date": "2025-04-23 19:49:49",
        "sender_id": -1001484150043,
        "first_name": null,
        "last_name": null,
        "username": null,
        "message": "23.04.2025 Czech ğŸ‡¨ğŸ‡¿\nSparta Prague against Victoria Plzen",
        "reply_to": null
    },
    {
        "message_id": 29516,
        "date": "2025-04-23 19:28:41",
        "sender_id": -1001484150043,
        "first_name": null,
        "last_name": null,
        "username": null,
        "message": "",
        "reply_to": null
    },
    {
        "message_id": 29515,
        "date": "2025-04-23 19:28:40",
        "sender_id": -1001484150043,
        "first_name": null,
        "last_name": null,
        "username": null,
        "message": "",
        "reply_to": null
    },
    {
        "message_id": 29514,
        "date": "2025-04-23 19:28:40",
        "sender_id": -1001484150043,
        "first_name": null,
        "last_name": null,
        "username": null,
        "message": "23.04.2025 Italy ğŸ‡®ğŸ‡¹\nGenoa against Lazio. Protest of the ultras of Genoa against modern football.\nin particular because after the death of the pope crazy decisions were made to the detriment of the fans.",
        "reply_to": null
    },
    {
        "message_id": 29513,
        "date": "2025-04-23 18:19:10",
        "sender_id": -1001484150043,
        "first_name": null,
        "last_name": null,
        "username": null,
        "message": "",
        "reply_to": null
    },
    {
        "message_id": 29512,
        "date": "2025-04-23 18:19:10",
        "sender_id": -1001484150043,
        "first_name": null,
        "last_name": null,
        "username": null,
        "message": "",
        "reply_to": null
    },
    {
        "message_id": 29511,
        "date": "2025-04-23 18:19:10",
        "sender_id": -1001484150043,
        "first_name": null,
        "last_name": null,
        "username": null,
        "message": "",
        "reply_to": null
    },
    {
        "message_id": 29510,
        "date": "2025-04-23 18:19:09",
        "sender_id": -1001484150043,
        "first_name": null,
        "last_name": null,
        "username": null,
        "message": "",
        "reply_to": null
    },
    {
        "message_id": 29509,
        "date": "2025-04-23 18:19:09",
        "sender_id": -1001484150043,
        "first_name": null,
        "last_name": null,
        "username": null,
        "message": "23.04.2025 Serbia ğŸ‡·ğŸ‡¸\nCrvena Zvezda vs 1312 away",
        "reply_to": null
    },
    {
        "message_id": 29504,
        "date": "2025-04-23 18:13:03",
        "sender_id": -1001484150043,
        "first_name": null,
        "last_name": null,
        "username": null,
        "message": "22.04.2025 Serbia ğŸ‡·ğŸ‡¸\nCrvena Zvezda vs 1312 away",
        "reply_to": null
    },
    {
        "message_id": 29503,
        "date": "2025-04-23 16:25:52",
        "sender_id": -1001484150043,
        "first_name": null,
        "last_name": null,
        "username": null,
        "message": "",
        "reply_to": null
    },
    {
        "message_id": 29502,
        "date": "2025-04-23 16:25:51",
        "sender_id": -1001484150043,
        "first_name": null,
        "last_name": null,
        "username": null,
        "message": "",
        "reply_to": null
    },
    {
        "message_id": 29501,
        "date": "2025-04-23 16:25:51",
        "sender_id": -1001484150043,
        "first_name": null,
        "last_name": null,
        "username": null,
        "message": "21.04.2025 Poland ğŸ‡µğŸ‡± \nRuch ChorzÃ³w away against Kotwica KoÅ‚obrzeg",
        "reply_to": null
    },
    {
        "message_id": 29500,
        "date": "2025-04-23 16:00:23",
        "sender_id": -1001484150043,
        "first_name": null,
        "last_name": null,
        "username": null,
        "message": "23.04.2025 Netherlands ğŸ‡³ğŸ‡±\nGo Ahead Eagles cupfinal party",
        "reply_to": 29484
    },
    {
        "message_id": 29499,
        "date": "2025-04-23 12:38:53",
        "sender_id": -1001484150043,
        "first_name": null,
        "last_name": null,
        "username": null,
        "message": "12.04.2025 France ğŸ‡«ğŸ‡·\n12-15 Monaco ultras vs 5-7 Marseille.",
        "reply_to": null
    },
    {
        "message_id": 29498,
        "date": "2025-04-22 18:41:44",
        "sender_id": -1001484150043,
        "first_name": null,
        "last_name": null,
        "username": null,
        "message": "",
        "reply_to": null
    },
    {
        "message_id": 29497,
        "date": "2025-04-22 18:41:43",
        "sender_id": -1001484150043,
        "first_name": null,
        "last_name": null,
        "username": null,
        "message": "",
        "reply_to": null
    },
    {
        "message_id": 29496,
        "date": "2025-04-22 18:41:43",
        "sender_id": -1001484150043,
        "first_name": null,
        "last_name": null,
        "username": null,
        "message": "XX.04.2025 NorwayğŸ‡³ğŸ‡´ Arrange fight, U21. VÃ¥lerenga Fight Team Yngre (blue) vs Rosenborg (Ballklubben Gate Sport, black). 3x3. Win. VÃ¥lerenga",
        "reply_to": null
    },
    {
        "message_id": 29495,
        "date": "2025-04-22 18:16:30",
        "sender_id": -1001484150043,
        "first_name": null,
        "last_name": null,
        "username": null,
        "message": "",
        "reply_to": null
    },
    {
        "message_id": 29494,
        "date": "2025-04-22 18:16:30",
        "sender_id": -1001484150043,
        "first_name": null,
        "last_name": null,
        "username": null,
        "message": "",
        "reply_to": null
    },
    {
        "message_id": 29493,
        "date": "2025-04-22 18:16:29",
        "sender_id": -1001484150043,
        "first_name": null,
        "last_name": null,
        "username": null,
        "message": "XX.04.2025 NorwayğŸ‡³ğŸ‡´ Arrange fight, U21. VÃ¥lerenga Fight Team Yngre vs Rosenborg (Ballklubben Gate Sport). 3x3. Win. VÃ¥lerenga",
        "reply_to": null
    },
    {
        "message_id": 29492,
        "date": "2025-04-22 14:46:24",
        "sender_id": -1001484150043,
        "first_name": null,
        "last_name": null,
        "username": null,
        "message": "",
        "reply_to": null
    },
    {
        "message_id": 29491,
        "date": "2025-04-22 14:46:24",
        "sender_id": -1001484150043,
        "first_name": null,
        "last_name": null,
        "username": null,
        "message": "",
        "reply_to": null
    },
    {
        "message_id": 29490,
        "date": "2025-04-22 14:46:23",
        "sender_id": -1001484150043,
        "first_name": null,
        "last_name": null,
        "username": null,
        "message": "",
        "reply_to": null
    },
    {
        "message_id": 29489,
        "date": "2025-04-22 14:46:23",
        "sender_id": -1001484150043,
        "first_name": null,
        "last_name": null,
        "username": null,
        "message": "",
        "reply_to": null
    },
    {
        "message_id": 29488,
        "date": "2025-04-22 14:46:22",
        "sender_id": -1001484150043,
        "first_name": null,
        "last_name": null,
        "username": null,
        "message": "21.04.2025 PolandğŸ‡µğŸ‡± \nÅKS ÅÃ³dÅº - GKS Tychy",
        "reply_to": null
    },
    {
        "message_id": 29487,
        "date": "2025-04-22 13:45:29",
        "sender_id": -1001484150043,
        "first_name": null,
        "last_name": null,
        "username": null,
        "message": "",
        "reply_to": null
    },
    {
        "message_id": 29486,
        "date": "2025-04-22 13:45:29",
        "sender_id": -1001484150043,
        "first_name": null,
        "last_name": null,
        "username": null,
        "message": "",
        "reply_to": null
    },
    {
        "message_id": 29485,
        "date": "2025-04-22 13:45:28",
        "sender_id": -1001484150043,
        "first_name": null,
        "last_name": null,
        "username": null,
        "message": "",
        "reply_to": null
    },
    {
        "message_id": 29484,
        "date": "2025-04-22 13:45:28",
        "sender_id": -1001484150043,
        "first_name": null,
        "last_name": null,
        "username": null,
        "message": "21.04.2025 Netherlands ğŸ‡³ğŸ‡± cupfinal.\nGo Ahead Eagles yesterday against AZ Alkmaar",
        "reply_to": null
    },
    {
        "message_id": 29483,
        "date": "2025-04-22 06:41:05",
        "sender_id": -1001484150043,
        "first_name": null,
        "last_name": null,
        "username": null,
        "message": "",
        "reply_to": null
    },
    {
        "message_id": 29482,
        "date": "2025-04-22 06:41:05",
        "sender_id": -1001484150043,
        "first_name": null,
        "last_name": null,
        "username": null,
        "message": "21.04.2025 Scotland ğŸ´ó §ó ¢ó ³ó £ó ´ó ¿\nUnion Bears (Rangers) graffiti about the death of Pope Francis\n\nFew hours later Celtic change the graffiti, reminding rangers that they lost all material earlier this season",
        "reply_to": null
    },
    {
        "message_id": 29481,
        "date": "2025-04-21 19:38:51",
        "sender_id": -1001484150043,
        "first_name": null,
        "last_name": null,
        "username": null,
        "message": "",
        "reply_to": null
    },
    {
        "message_id": 29480,
        "date": "2025-04-21 19:38:51",
        "sender_id": -1001484150043,
        "first_name": null,
        "last_name": null,
        "username": null,
        "message": "",
        "reply_to": null
    },
    {
        "message_id": 29479,
        "date": "2025-04-21 19:38:50",
        "sender_id": -1001484150043,
        "first_name": null,
        "last_name": null,
        "username": null,
        "message": "",
        "reply_to": null
    },
    {
        "message_id": 29478,
        "date": "2025-04-21 19:38:50",
        "sender_id": -1001484150043,
        "first_name": null,
        "last_name": null,
        "username": null,
        "message": "21.04.2025 Denmark ğŸ‡©ğŸ‡° \nAarhus tifo today in Copenhagen and yesterday running battles with police in city centre",
        "reply_to": null
    },
    {
        "message_id": 29477,
        "date": "2025-04-21 19:27:58",
        "sender_id": -1001484150043,
        "first_name": null,
        "last_name": null,
        "username": null,
        "message": "",
        "reply_to": null
    },
    {
        "message_id": 29476,
        "date": "2025-04-21 19:27:58",
        "sender_id": -1001484150043,
        "first_name": null,
        "last_name": null,
        "username": null,
        "message": "",
        "reply_to": null
    },
    {
        "message_id": 29475,
        "date": "2025-04-21 19:27:58",
        "sender_id": -1001484150043,
        "first_name": null,
        "last_name": null,
        "username": null,
        "message": "21.04.2025 Switzerland ğŸ‡¨ğŸ‡­ \nYoung Boys - FC ZÃ¼rich. Pyro FCZ",
        "reply_to": null
    },
    {
        "message_id": 29474,
        "date": "2025-04-21 17:50:35",
        "sender_id": -1001484150043,
        "first_name": null,
        "last_name": null,
        "username": null,
        "message": "",
        "reply_to": null
    },
    {
        "message_id": 29473,
        "date": "2025-04-21 17:50:35",
        "sender_id": -1001484150043,
        "first_name": null,
        "last_name": null,
        "username": null,
        "message": "21.04.2025 Netherlands ğŸ‡³ğŸ‡± cupfinal.\nAlkmaar - Go Ahead Eagles",
        "reply_to": null
    },
    {
        "message_id": 29472,
        "date": "2025-04-21 15:34:40",
        "sender_id": -1001484150043,
        "first_name": null,
        "last_name": null,
        "username": null,
        "message": "",
        "reply_to": null
    },
    {
        "message_id": 29471,
        "date": "2025-04-21 15:34:40",
        "sender_id": -1001484150043,
        "first_name": null,
        "last_name": null,
        "username": null,
        "message": "21.04.2025 Netherlands ğŸ‡³ğŸ‡±\nAlkmaar before cupfinal vs Go Ahead Eagles",
        "reply_to": null
    },
    {
        "message_id": 29470,
        "date": "2025-04-21 14:37:42",
        "sender_id": -1001484150043,
        "first_name": null,
        "last_name": null,
        "username": null,
        "message": "20.04.2025 France ğŸ‡«ğŸ‡·\nBrest attacked Lens on highway",
        "reply_to": 29457
    },
    {
        "message_id": 29469,
        "date": "2025-04-21 13:38:23",
        "sender_id": -1001484150043,
        "first_name": null,
        "last_name": null,
        "username": null,
        "message": "21.04.2025 Netherlands ğŸ‡³ğŸ‡±\nAlkmaar on tour Rotterdam cupfinal vs Go Ahead Eagles",
        "reply_to": null
    },
    {
        "message_id": 29468,
        "date": "2025-04-21 13:37:25",
        "sender_id": -1001484150043,
        "first_name": null,
        "last_name": null,
        "username": null,
        "message": "",
        "reply_to": null
    },
    {
        "message_id": 29467,
        "date": "2025-04-21 13:37:25",
        "sender_id": -1001484150043,
        "first_name": null,
        "last_name": null,
        "username": null,
        "message": "",
        "reply_to": null
    },
    {
        "message_id": 29466,
        "date": "2025-04-21 13:37:25",
        "sender_id": -1001484150043,
        "first_name": null,
        "last_name": null,
        "username": null,
        "message": "21.04.2025 Poland ğŸ‡µğŸ‡± \nperformance Jagiellonia BiaÅ‚ystok against ZagÅ‚Ä™bie Lublin",
        "reply_to": null
    },
    {
        "message_id": 29465,
        "date": "2025-04-21 11:52:45",
        "sender_id": -1001484150043,
        "first_name": null,
        "last_name": null,
        "username": null,
        "message": "21.04.2025 Netherlands ğŸ‡³ğŸ‡±\nEagles firm ready for the final cup",
        "reply_to": null
    },
    {
        "message_id": 29464,
        "date": "2025-04-21 10:00:56",
        "sender_id": -1001484150043,
        "first_name": null,
        "last_name": null,
        "username": null,
        "message": "",
        "reply_to": null
    },
    {
        "message_id": 29463,
        "date": "2025-04-21 10:00:55",
        "sender_id": -1001484150043,
        "first_name": null,
        "last_name": null,
        "username": null,
        "message": "21.04.2025 Italy ğŸ‡®ğŸ‡¹ \nUltras Udinese 1995 in Turin after the match was postponed, with the banner: â€˜Thank you for listening to us, but is playing on Sunday a crime?â€™",
        "reply_to": null
    },
    {
        "message_id": 29462,
        "date": "2025-04-21 07:53:41",
        "sender_id": -1001484150043,
        "first_name": null,
        "last_name": null,
        "username": null,
        "message": "",
        "reply_to": null
    },
    {
        "message_id": 29461,
        "date": "2025-04-21 07:53:40",
        "sender_id": -1001484150043,
        "first_name": null,
        "last_name": null,
        "username": null,
        "message": "",
        "reply_to": null
    },
    {
        "message_id": 29460,
        "date": "2025-04-21 07:53:40",
        "sender_id": -1001484150043,
        "first_name": null,
        "last_name": null,
        "username": null,
        "message": "",
        "reply_to": null
    },
    {
        "message_id": 29459,
        "date": "2025-04-21 07:53:39",
        "sender_id": -1001484150043,
        "first_name": null,
        "last_name": null,
        "username": null,
        "message": "20.04.2025 Italy ğŸ‡®ğŸ‡¹\nAtalanta away against AC Milan",
        "reply_to": null
    },
    {
        "message_id": 29458,
        "date": "2025-04-20 21:47:16",
        "sender_id": -1001484150043,
        "first_name": null,
        "last_name": null,
        "username": null,
        "message": "20.04.2025 FranceğŸ‡«ğŸ‡·\nCeltic Ultras Brest vs Red Tigers + KSO93 (Lens). Win. Lens",
        "reply_to": 29440
    },
    {
        "message_id": 29457,
        "date": "2025-04-20 21:18:08",
        "sender_id": -1001484150043,
        "first_name": null,
        "last_name": null,
        "username": null,
        "message": "20.04.2025 France ğŸ‡«ğŸ‡·\nBrest attacked Lens on highway",
        "reply_to": 29454
    },
    {
        "message_id": 29456,
        "date": "2025-04-20 21:04:01",
        "sender_id": -1001484150043,
        "first_name": null,
        "last_name": null,
        "username": null,
        "message": "20.04.2025 Sweden ğŸ‡¸ğŸ‡ª\nAIK Stockholm ğ•³ooligans and ultras (Firman Boys + Ultras North + Sol Invictus)",
        "reply_to": null
    },
    {
        "message_id": 29455,
        "date": "2025-04-20 21:02:44",
        "sender_id": -1001484150043,
        "first_name": null,
        "last_name": null,
        "username": null,
        "message": "",
        "reply_to": null
    },
    {
        "message_id": 29454,
        "date": "2025-04-20 21:02:43",
        "sender_id": -1001484150043,
        "first_name": null,
        "last_name": null,
        "username": null,
        "message": "20.04.2025 France ğŸ‡«ğŸ‡·\nBrest attaked after match Lens",
        "reply_to": null
    },
    {
        "message_id": 29453,
        "date": "2025-04-20 20:12:46",
        "sender_id": -1001484150043,
        "first_name": null,
        "last_name": null,
        "username": null,
        "message": "20.04.2025 DenmarkğŸ‡©ğŸ‡° Aarhus in Copenhagen day before match",
        "reply_to": null
    },
    {
        "message_id": 29452,
        "date": "2025-04-20 19:49:32",
        "sender_id": -1001484150043,
        "first_name": null,
        "last_name": null,
        "username": null,
        "message": "",
        "reply_to": null
    },
    {
        "message_id": 29451,
        "date": "2025-04-20 19:49:32",
        "sender_id": -1001484150043,
        "first_name": null,
        "last_name": null,
        "username": null,
        "message": "20.04.2025 FranceğŸ‡«ğŸ‡· performance from Saint-Ã‰tienne against Olympique Lyonnais",
        "reply_to": null
    },
    {
        "message_id": 29450,
        "date": "2025-04-20 19:40:31",
        "sender_id": -1001484150043,
        "first_name": null,
        "last_name": null,
        "username": null,
        "message": "20.04.2025 Germany ğŸ‡©ğŸ‡ª 2 League.\nAfter FC KÃ¶ln received a â‚¬310,000 fine from the DFB last week for a large pyro show, around 200 masked FC KÃ¶ln ultras climbed onto the fence in the second half. A banner was hanging on the fence with the inscription \"your fines don't ignite, we do,\" and they acted as if the next big pyro display was about to take place. However, the KÃ¶ln ultras only fired confetti and displayed the next message: \"Not today, but soon, promise!\"",
        "reply_to": null
    },
    {
        "message_id": 29449,
        "date": "2025-04-20 18:29:57",
        "sender_id": -1001484150043,
        "first_name": null,
        "last_name": null,
        "username": null,
        "message": "20.04.2025 Germany ğŸ‡©ğŸ‡ª 3 league.\nSaarbrÃ¼cken - Dynamo Dresden. Blue smoke in guest block ignited by remote detonator",
        "reply_to": 29446
    },
    {
        "message_id": 29448,
        "date": "2025-04-20 18:25:29",
        "sender_id": -1001484150043,
        "first_name": null,
        "last_name": null,
        "username": null,
        "message": "18.04.2025 FranceğŸ‡«ğŸ‡· Rennes vs Nantes.\nInfo Nantes: 130 Rennes and their friends (Tours, Saragosseâ€¦) vs 75 Nantes. 3 AM in the morning",
        "reply_to": 29406
    },
    {
        "message_id": 29447,
        "date": "2025-04-20 17:37:01",
        "sender_id": -1001484150043,
        "first_name": null,
        "last_name": null,
        "username": null,
        "message": "",
        "reply_to": null
    },
    {
        "message_id": 29446,
        "date": "2025-04-20 17:37:01",
        "sender_id": -1001484150043,
        "first_name": null,
        "last_name": null,
        "username": null,
        "message": "20.04.2025 Germany ğŸ‡©ğŸ‡ª 3 league.\nSaarbrÃ¼cken - Dynamo Dresden. Blue smoke in guest block ignited by remote detonator",
        "reply_to": null
    },
    {
        "message_id": 29445,
        "date": "2025-04-20 16:35:49",
        "sender_id": -1001484150043,
        "first_name": null,
        "last_name": null,
        "username": null,
        "message": "20.04.2025 Germany ğŸ‡©ğŸ‡ª 3 league.\nSaarbrÃ¼cken - Dynamo Dresden. Dynamo Dresden away",
        "reply_to": null
    },
    {
        "message_id": 29444,
        "date": "2025-04-20 16:05:44",
        "sender_id": -1001484150043,
        "first_name": null,
        "last_name": null,
        "username": null,
        "message": "",
        "reply_to": null
    },
    {
        "message_id": 29443,
        "date": "2025-04-20 16:05:43",
        "sender_id": -1001484150043,
        "first_name": null,
        "last_name": null,
        "username": null,
        "message": "",
        "reply_to": null
    },
    {
        "message_id": 29442,
        "date": "2025-04-20 16:05:43",
        "sender_id": -1001484150043,
        "first_name": null,
        "last_name": null,
        "username": null,
        "message": "20.04.2025 Netherlands ğŸ‡³ğŸ‡±\nGo Ahead Eagles last training before cup final against AZ",
        "reply_to": null
    },
    {
        "message_id": 29441,
        "date": "2025-04-20 14:50:33",
        "sender_id": -1001484150043,
        "first_name": null,
        "last_name": null,
        "username": null,
        "message": "20.04.2025 Netherlands ğŸ‡³ğŸ‡±\nGo Ahead hooligans painting a bridge in Alkmaar before cup final",
        "reply_to": null
    },
    {
        "message_id": 29440,
        "date": "2025-04-20 14:08:26",
        "sender_id": -1001484150043,
        "first_name": null,
        "last_name": null,
        "username": null,
        "message": "20.04.2025 FranceğŸ‡«ğŸ‡·\nCeltic Ultras Brest vs Red Tigers + KSO93 (Lens). Win. Lens",
        "reply_to": null
    },
    {
        "message_id": 29439,
        "date": "2025-04-20 13:50:21",
        "sender_id": -1001484150043,
        "first_name": null,
        "last_name": null,
        "username": null,
        "message": "XX.04.2025 GermanyğŸ‡©ğŸ‡ª Arranged fight, U23. Bremen vs Wuppertal ğŸ¤ Oberhausen 10x10. 2 min. Win. Bremen",
        "reply_to": null
    },
    {
        "message_id": 29438,
        "date": "2025-04-20 12:06:29",
        "sender_id": -1001484150043,
        "first_name": null,
        "last_name": null,
        "username": null,
        "message": "20.05.2025 NetherlandsğŸ‡³ğŸ‡± \nUtrecht - Ajax Amsterdam.\nAjax fight each other away",
        "reply_to": null
    },
    {
        "message_id": 29437,
        "date": "2025-04-20 10:53:34",
        "sender_id": -1001484150043,
        "first_name": null,
        "last_name": null,
        "username": null,
        "message": "",
        "reply_to": null
    },
    {
        "message_id": 29436,
        "date": "2025-04-20 10:53:34",
        "sender_id": -1001484150043,
        "first_name": null,
        "last_name": null,
        "username": null,
        "message": "",
        "reply_to": null
    },
    {
        "message_id": 29435,
        "date": "2025-04-20 10:53:34",
        "sender_id": -1001484150043,
        "first_name": null,
        "last_name": null,
        "username": null,
        "message": "",
        "reply_to": null
    },
    {
        "message_id": 29434,
        "date": "2025-04-20 10:53:33",
        "sender_id": -1001484150043,
        "first_name": null,
        "last_name": null,
        "username": null,
        "message": "19.04.2025 Switzerland ğŸ‡¨ğŸ‡­ \nFC Winterthur away vs Grasshopper Club ZÃ¼rich",
        "reply_to": null
    },
    {
        "message_id": 29433,
        "date": "2025-04-20 09:38:47",
        "sender_id": -1001484150043,
        "first_name": null,
        "last_name": null,
        "username": null,
        "message": "",
        "reply_to": null
    },
    {
        "message_id": 29432,
        "date": "2025-04-20 09:38:47",
        "sender_id": -1001484150043,
        "first_name": null,
        "last_name": null,
        "username": null,
        "message": "",
        "reply_to": null
    },
    {
        "message_id": 29431,
        "date": "2025-04-20 09:38:47",
        "sender_id": -1001484150043,
        "first_name": null,
        "last_name": null,
        "username": null,
        "message": "",
        "reply_to": null
    },
    {
        "message_id": 29430,
        "date": "2025-04-20 09:38:46",
        "sender_id": -1001484150043,
        "first_name": null,
        "last_name": null,
        "username": null,
        "message": "",
        "reply_to": null
    },
    {
        "message_id": 29429,
        "date": "2025-04-20 09:38:46",
        "sender_id": -1001484150043,
        "first_name": null,
        "last_name": null,
        "username": null,
        "message": "19.04.2025 GermanyğŸ‡©ğŸ‡ª 3 league.\nAlemannia Aachen in MÃ¼nich vs 1860 MÃ¼nich",
        "reply_to": null
    },
    {
        "message_id": 29428,
        "date": "2025-04-20 09:32:54",
        "sender_id": -1001484150043,
        "first_name": null,
        "last_name": null,
        "username": null,
        "message": "",
        "reply_to": null
    },
    {
        "message_id": 29427,
        "date": "2025-04-20 09:32:54",
        "sender_id": -1001484150043,
        "first_name": null,
        "last_name": null,
        "username": null,
        "message": "19.04.2025 CroatiağŸ‡­ğŸ‡· Derby match betwen Istra and Rijeka and pyroshow of away fans",
        "reply_to": null
    },
    {
        "message_id": 29426,
        "date": "2025-04-20 07:00:56",
        "sender_id": -1001484150043,
        "first_name": null,
        "last_name": null,
        "username": null,
        "message": "XX.04.2025 RussiağŸ‡·ğŸ‡º Arrange fight.\nyouth Fearless (CSKA Moscow) vs youth Inquisitors (Spartak Moscow). 10x10. Win. Spartak",
        "reply_to": null
    },
    {
        "message_id": 29425,
        "date": "2025-04-20 06:53:52",
        "sender_id": -1001484150043,
        "first_name": null,
        "last_name": null,
        "username": null,
        "message": "",
        "reply_to": null
    },
    {
        "message_id": 29424,
        "date": "2025-04-20 06:53:51",
        "sender_id": -1001484150043,
        "first_name": null,
        "last_name": null,
        "username": null,
        "message": "",
        "reply_to": null
    },
    {
        "message_id": 29423,
        "date": "2025-04-20 06:53:51",
        "sender_id": -1001484150043,
        "first_name": null,
        "last_name": null,
        "username": null,
        "message": "",
        "reply_to": null
    },
    {
        "message_id": 29422,
        "date": "2025-04-20 06:53:51",
        "sender_id": -1001484150043,
        "first_name": null,
        "last_name": null,
        "username": null,
        "message": "20.04.2025 England ğŸ´ó §ó ¢ó ¥ó ®ó §ó ¿\nManchester City one year Nortnern Figğ•³t Collective (MCFC). One year of trying to change the scene in England, one year of silence from every other firm here.",
        "reply_to": null
    },
    {
        "message_id": 29421,
        "date": "2025-04-20 06:43:46",
        "sender_id": -1001484150043,
        "first_name": null,
        "last_name": null,
        "username": null,
        "message": "19.04.2025 Spain ğŸ‡ªğŸ‡¸ Derby Ezkerraldea. Barakaldo vs Sestao. Indar Horibeltz (left) attacked iparlabeak (right). Win. 1312",
        "reply_to": null
    },
    {
        "message_id": 29420,
        "date": "2025-04-19 20:45:58",
        "sender_id": -1001484150043,
        "first_name": null,
        "last_name": null,
        "username": null,
        "message": "",
        "reply_to": null
    },
    {
        "message_id": 29419,
        "date": "2025-04-19 20:45:57",
        "sender_id": -1001484150043,
        "first_name": null,
        "last_name": null,
        "username": null,
        "message": "",
        "reply_to": null
    },
    {
        "message_id": 29418,
        "date": "2025-04-19 20:45:57",
        "sender_id": -1001484150043,
        "first_name": null,
        "last_name": null,
        "username": null,
        "message": "",
        "reply_to": null
    },
    {
        "message_id": 29417,
        "date": "2025-04-19 20:45:57",
        "sender_id": -1001484150043,
        "first_name": null,
        "last_name": null,
        "username": null,
        "message": "",
        "reply_to": null
    },
    {
        "message_id": 29416,
        "date": "2025-04-19 20:45:56",
        "sender_id": -1001484150043,
        "first_name": null,
        "last_name": null,
        "username": null,
        "message": "",
        "reply_to": null
    },
    {
        "message_id": 29415,
        "date": "2025-04-19 20:45:56",
        "sender_id": -1001484150043,
        "first_name": null,
        "last_name": null,
        "username": null,
        "message": "19.04.2025 GermanyğŸ‡©ğŸ‡ª 2 league.\nSchalke 04 - Hamburger. Pyro HSV away",
        "reply_to": null
    },
    {
        "message_id": 29414,
        "date": "2025-04-19 20:02:12",
        "sender_id": -1001484150043,
        "first_name": null,
        "last_name": null,
        "username": null,
        "message": "",
        "reply_to": null
    },
    {
        "message_id": 29413,
        "date": "2025-04-19 20:02:12",
        "sender_id": -1001484150043,
        "first_name": null,
        "last_name": null,
        "username": null,
        "message": "19.04.2025 GermanyğŸ‡©ğŸ‡ª 2 league.\nSchalke 04 - Hamburger. Pyro HSV away",
        "reply_to": null
    },
    {
        "message_id": 29412,
        "date": "2025-04-19 19:37:47",
        "sender_id": -1001484150043,
        "first_name": null,
        "last_name": null,
        "username": null,
        "message": "",
        "reply_to": null
    },
    {
        "message_id": 29411,
        "date": "2025-04-19 19:37:47",
        "sender_id": -1001484150043,
        "first_name": null,
        "last_name": null,
        "username": null,
        "message": "",
        "reply_to": null
    },
    {
        "message_id": 29410,
        "date": "2025-04-19 19:37:46",
        "sender_id": -1001484150043,
        "first_name": null,
        "last_name": null,
        "username": null,
        "message": "",
        "reply_to": null
    },
    {
        "message_id": 29409,
        "date": "2025-04-19 19:37:46",
        "sender_id": -1001484150043,
        "first_name": null,
        "last_name": null,
        "username": null,
        "message": "",
        "reply_to": null
    },
    {
        "message_id": 29408,
        "date": "2025-04-19 19:37:45",
        "sender_id": -1001484150043,
        "first_name": null,
        "last_name": null,
        "username": null,
        "message": "18.04.2025 FranceğŸ‡«ğŸ‡·\nNancy - Aubagne",
        "reply_to": null
    },
    {
        "message_id": 29407,
        "date": "2025-04-19 18:11:55",
        "sender_id": -1001484150043,
        "first_name": null,
        "last_name": null,
        "username": null,
        "message": "19.04.2025 RussiağŸ‡·ğŸ‡º Arrange fight.\nyouth Community (Spartak) vs youth ĞĞ¿Ñ€Ğ¸Ñ‡Ğ½Ğ¸ĞºĞ¸ (CSKA Moscow). 10Ñ…10. 2 min. Win. Spartak\nğŸ“¸ ĞĞ¿Ñ€Ğ¸Ñ‡Ğ½Ğ¸ĞºĞ¸ (CSKA Moscow)",
        "reply_to": null
    },
    {
        "message_id": 29406,
        "date": "2025-04-19 17:27:30",
        "sender_id": -1001484150043,
        "first_name": null,
        "last_name": null,
        "username": null,
        "message": "18.04.2025 FranceğŸ‡«ğŸ‡· Rennes vs Nantes.\nInfo Nantes: 130 Rennes and their friends (Tours, Saragosseâ€¦) vs 75 Nantes. 3 AM in the morning",
        "reply_to": 29403
    },
    {
        "message_id": 29405,
        "date": "2025-04-19 17:15:34",
        "sender_id": -1001484150043,
        "first_name": null,
        "last_name": null,
        "username": null,
        "message": "19.04.2025 Scotland ğŸ´ó §ó ¢ó ³ó £ó ´ó ¿ ultras Aberdeen",
        "reply_to": null
    },
    {
        "message_id": 29404,
        "date": "2025-04-19 12:30:33",
        "sender_id": -1001484150043,
        "first_name": null,
        "last_name": null,
        "username": null,
        "message": "XX.04.2025 Netherlands ğŸ‡³ğŸ‡± Arrange youth fight. Maas Firm Cohortes (MVV Maastricht) vs RFJK Arnhem (Vitesse).  8x8. Win. Maas Firm Cohortes",
        "reply_to": null
    },
    {
        "message_id": 29403,
        "date": "2025-04-19 11:45:51",
        "sender_id": -1001484150043,
        "first_name": null,
        "last_name": null,
        "username": null,
        "message": "18.04.2025 FranceğŸ‡«ğŸ‡· Rennes vs Nantes.\nInfo Rennes: Nantes came for the match. After the game, Rennes decided to go to their city. \nWe decide to go to their bar.\nVery violent contact of 10min, without anyone wanting to let go.\nAbout 100 guys on each side. Win. Rennes.\nVery correct and fair fight, big respect to both groups",
        "reply_to": null
    },
    {
        "message_id": 29402,
        "date": "2025-04-19 11:09:56",
        "sender_id": -1001484150043,
        "first_name": null,
        "last_name": null,
        "username": null,
        "message": "",
        "reply_to": null
    },
    {
        "message_id": 29401,
        "date": "2025-04-19 11:09:56",
        "sender_id": -1001484150043,
        "first_name": null,
        "last_name": null,
        "username": null,
        "message": "",
        "reply_to": null
    },
    {
        "message_id": 29400,
        "date": "2025-04-19 11:09:56",
        "sender_id": -1001484150043,
        "first_name": null,
        "last_name": null,
        "username": null,
        "message": "19.04.2025 PolandğŸ‡µğŸ‡± Traditional Easter celebrations in Jagiellonia Bialystok, Wishing all fans a happy Easter and remember that Europe is âœï¸",
        "reply_to": null
    },
    {
        "message_id": 29396,
        "date": "2025-04-19 11:02:51",
        "sender_id": -1001484150043,
        "first_name": null,
        "last_name": null,
        "username": null,
        "message": "18.04.2025 Italy ğŸ‡®ğŸ‡¹Â  Seria C.\nNovara vs Trento",
        "reply_to": 29394
    },
    {
        "message_id": 29394,
        "date": "2025-04-19 10:44:16",
        "sender_id": -1001484150043,
        "first_name": null,
        "last_name": null,
        "username": null,
        "message": "18.04.2025 Italy ğŸ‡®ğŸ‡¹  Seria C.\nNovara vs Trento",
        "reply_to": null
    },
    {
        "message_id": 29393,
        "date": "2025-04-19 10:00:14",
        "sender_id": -1001484150043,
        "first_name": null,
        "last_name": null,
        "username": null,
        "message": "17.04.2025 Denmark ğŸ‡©ğŸ‡° \nMidtjylland fans threw yellow smoke bombs (BrÃ¸ndby colors) at the KÃ¸benhavn away section",
        "reply_to": null
    },
    {
        "message_id": 29392,
        "date": "2025-04-19 09:55:05",
        "sender_id": -1001484150043,
        "first_name": null,
        "last_name": null,
        "username": null,
        "message": "17.04.2025 Europa League.\nLyonğŸ‡¨ğŸ‡µ away in Manchester ğŸ´ó §ó ¢ó ¥ó ®ó §ó ¿ before match against MU",
        "reply_to": null
    },
    {
        "message_id": 29391,
        "date": "2025-04-19 04:55:47",
        "sender_id": -1001484150043,
        "first_name": null,
        "last_name": null,
        "username": null,
        "message": "",
        "reply_to": null
    },
    {
        "message_id": 29390,
        "date": "2025-04-19 04:55:47",
        "sender_id": -1001484150043,
        "first_name": null,
        "last_name": null,
        "username": null,
        "message": "18.04.2025 Ireland ğŸ‡®ğŸ‡ª\nFamous 45 Ultras (Drogheda United) vs Shelbourne",
        "reply_to": null
    },
    {
        "message_id": 29389,
        "date": "2025-04-18 20:37:01",
        "sender_id": -1001484150043,
        "first_name": null,
        "last_name": null,
        "username": null,
        "message": "13.04.2025 Germany ğŸ‡©ğŸ‡ª \nSchalke waiting for Borussia Dortmund last Sunday\n\np.s. Dortmund played in munich saturday night - and Schalke played in Regensburg this sunday",
        "reply_to": null
    },
    {
        "message_id": 29388,
        "date": "2025-04-18 19:20:17",
        "sender_id": -1001484150043,
        "first_name": null,
        "last_name": null,
        "username": null,
        "message": "",
        "reply_to": null
    },
    {
        "message_id": 29387,
        "date": "2025-04-18 19:20:17",
        "sender_id": -1001484150043,
        "first_name": null,
        "last_name": null,
        "username": null,
        "message": "18.04.2025 Belgium ğŸ‡§ğŸ‡ª 2 division. \nZulte Waregem against RWDM\n\npyroğŸ”¥ https://t.me/gruppaof_canal",
        "reply_to": null
    },
    {
        "message_id": 29386,
        "date": "2025-04-18 17:18:39",
        "sender_id": -1001484150043,
        "first_name": null,
        "last_name": null,
        "username": null,
        "message": "",
        "reply_to": null
    },
    {
        "message_id": 29385,
        "date": "2025-04-18 17:18:39",
        "sender_id": -1001484150043,
        "first_name": null,
        "last_name": null,
        "username": null,
        "message": "17.04.2025 Europa League.\nAthletic BilbaoğŸ‡ªğŸ‡¸ - RangersğŸ´ó §ó ¢ó ³ó £ó ´ó ¿\nInfo Union Bears (Rangers): Bilbao attacked a few scarfers when in big groups yet are nowhere to be seen when we walked with no police through their city 2 nights in a row. Both PAOK (Basketball) and UB (Rangers) stayed in the same street and knew nothing of some small standalone police office - do not make cowardly excuses! You knew where we were, you knew where we were staying and you didnâ€™t come. Anytime we came into contact with some of your guys, they had merch taken off them or they were chased through the streets. Non event!",
        "reply_to": null
    },
    {
        "message_id": 29384,
        "date": "2025-04-18 13:09:32",
        "sender_id": -1001484150043,
        "first_name": null,
        "last_name": null,
        "username": null,
        "message": "17.03.2025 Europa League. \nEintracht FrankfurtğŸ‡©ğŸ‡ª - Tottenham ğŸ´ó §ó ¢ó ¥ó ®ó §ó ¿",
        "reply_to": 29357
    },
    {
        "message_id": 29383,
        "date": "2025-04-18 12:09:48",
        "sender_id": -1001484150043,
        "first_name": null,
        "last_name": null,
        "username": null,
        "message": "17.04.2025 Conference League.\nDjurgÃ¥rdenğŸ‡¸ğŸ‡ª last night after win against Rapid WienğŸ‡¦ğŸ‡¹",
        "reply_to": null
    },
    {
        "message_id": 29382,
        "date": "2025-04-18 10:07:47",
        "sender_id": -1001484150043,
        "first_name": null,
        "last_name": null,
        "username": null,
        "message": "17.04.2025 Europa League.\nRangersğŸ´ó §ó ¢ó ³ó £ó ´ó ¿ being beaten by Athletic BilbaoğŸ‡ªğŸ‡¸",
        "reply_to": 29379
    },
    {
        "message_id": 29380,
        "date": "2025-04-18 09:54:18",
        "sender_id": -1001484150043,
        "first_name": null,
        "last_name": null,
        "username": null,
        "message": "17.04.2025 Europa League.\n Rangers ğ•³ğŸ´ó §ó ¢ó ³ó £ó ´ó ¿ away Athletic BilbaoğŸ‡ªğŸ‡¸. No Bilbao, no police.",
        "reply_to": null
    },
    {
        "message_id": 29379,
        "date": "2025-04-18 09:10:27",
        "sender_id": -1001484150043,
        "first_name": null,
        "last_name": null,
        "username": null,
        "message": "17.04.2025 Europa League.\n RangersğŸ´ó §ó ¢ó ³ó £ó ´ó ¿ being beaten by Athletic BilbaoğŸ‡ªğŸ‡¸",
        "reply_to": null
    },
    {
        "message_id": 29378,
        "date": "2025-04-18 05:35:56",
        "sender_id": -1001484150043,
        "first_name": null,
        "last_name": null,
        "username": null,
        "message": "",
        "reply_to": null
    },
    {
        "message_id": 29377,
        "date": "2025-04-18 05:35:55",
        "sender_id": -1001484150043,
        "first_name": null,
        "last_name": null,
        "username": null,
        "message": "",
        "reply_to": null
    },
    {
        "message_id": 29376,
        "date": "2025-04-18 05:35:55",
        "sender_id": -1001484150043,
        "first_name": null,
        "last_name": null,
        "username": null,
        "message": "17.04.2025 Conference League. \nRapid Wien ğŸ‡¦ğŸ‡¹ home against DjurgÃ¥rden ğŸ‡¸ğŸ‡ª",
        "reply_to": null
    },
    {
        "message_id": 29375,
        "date": "2025-04-17 20:25:23",
        "sender_id": -1001484150043,
        "first_name": null,
        "last_name": null,
        "username": null,
        "message": "",
        "reply_to": 29369
    },
    {
        "message_id": 29374,
        "date": "2025-04-17 20:25:22",
        "sender_id": -1001484150043,
        "first_name": null,
        "last_name": null,
        "username": null,
        "message": "",
        "reply_to": 29369
    },
    {
        "message_id": 29373,
        "date": "2025-04-17 20:25:22",
        "sender_id": -1001484150043,
        "first_name": null,
        "last_name": null,
        "username": null,
        "message": "17.04.2025 Conference League. \nPyro Legia Warszawa ğŸ‡µğŸ‡± away against ChelseağŸ´ó §ó ¢ó ¥ó ®ó §ó ¿",
        "reply_to": 29369
    },
    {
        "message_id": 29372,
        "date": "2025-04-17 20:21:14",
        "sender_id": -1001484150043,
        "first_name": null,
        "last_name": null,
        "username": null,
        "message": "",
        "reply_to": null
    },
    {
        "message_id": 29371,
        "date": "2025-04-17 20:21:14",
        "sender_id": -1001484150043,
        "first_name": null,
        "last_name": null,
        "username": null,
        "message": "",
        "reply_to": null
    },
    {
        "message_id": 29370,
        "date": "2025-04-17 20:21:14",
        "sender_id": -1001484150043,
        "first_name": null,
        "last_name": null,
        "username": null,
        "message": "",
        "reply_to": null
    },
    {
        "message_id": 29369,
        "date": "2025-04-17 20:21:13",
        "sender_id": -1001484150043,
        "first_name": null,
        "last_name": null,
        "username": null,
        "message": "17.04.2025 Conference League. \nLegia Warszawa ğŸ‡µğŸ‡± away against Chelsea ğŸ´ó §ó ¢ó ¥ó ®ó §ó ¿",
        "reply_to": null
    },
    {
        "message_id": 29368,
        "date": "2025-04-17 20:09:35",
        "sender_id": -1001484150043,
        "first_name": null,
        "last_name": null,
        "username": null,
        "message": "17.04.2025 Europe League. \nEintracht FrankfurtğŸ‡©ğŸ‡ª against Tottenham LondonğŸ´ó §ó ¢ó ¥ó ®ó §ó ¿.\nâ€Die Adler sind auf Beutezug, WIR HABEN NOCH LANGE NICHT GENUGâ€œ",
        "reply_to": 29359
    },
    {
        "message_id": 29367,
        "date": "2025-04-17 20:02:04",
        "sender_id": -1001484150043,
        "first_name": null,
        "last_name": null,
        "username": null,
        "message": "",
        "reply_to": null
    },
    {
        "message_id": 29366,
        "date": "2025-04-17 20:02:04",
        "sender_id": -1001484150043,
        "first_name": null,
        "last_name": null,
        "username": null,
        "message": "17.04.2025 Conference League. \nLegia Warszawa ğŸ‡µğŸ‡± away against Chelsea ğŸ´ó §ó ¢ó ¥ó ®ó §ó ¿",
        "reply_to": null
    },
    {
        "message_id": 29365,
        "date": "2025-04-17 19:59:12",
        "sender_id": -1001484150043,
        "first_name": null,
        "last_name": null,
        "username": null,
        "message": "",
        "reply_to": null
    },
    {
        "message_id": 29364,
        "date": "2025-04-17 19:59:11",
        "sender_id": -1001484150043,
        "first_name": null,
        "last_name": null,
        "username": null,
        "message": "",
        "reply_to": null
    },
    {
        "message_id": 29363,
        "date": "2025-04-17 19:59:11",
        "sender_id": -1001484150043,
        "first_name": null,
        "last_name": null,
        "username": null,
        "message": "17.04.2025 Europe League. \nperformance Lazio ğŸ‡®ğŸ‡¹ today against BodÃ¸ / Glimt ğŸ‡³ğŸ‡´",
        "reply_to": null
    },
    {
        "message_id": 29362,
        "date": "2025-04-17 19:56:44",
        "sender_id": -1001484150043,
        "first_name": null,
        "last_name": null,
        "username": null,
        "message": "17.04.2025 Europe League. \nManchester UnitedğŸ´ó §ó ¢ó ¥ó ®ó §ó ¿ against Lyon ğŸ‡¨ğŸ‡µ",
        "reply_to": null
    },
    {
        "message_id": 29358,
        "date": "2025-04-17 19:41:46",
        "sender_id": -1001484150043,
        "first_name": null,
        "last_name": null,
        "username": null,
        "message": "",
        "reply_to": null
    },
    {
        "message_id": 29357,
        "date": "2025-04-17 19:41:45",
        "sender_id": -1001484150043,
        "first_name": null,
        "last_name": null,
        "username": null,
        "message": "17.03.2025 Europa League. \nEintracht FrankfurtğŸ‡©ğŸ‡ª - Tottenham ğŸ´ó §ó ¢ó ¥ó ®ó §ó ¿",
        "reply_to": null
    },
    {
        "message_id": 29356,
        "date": "2025-04-17 18:16:48",
        "sender_id": -1001484150043,
        "first_name": null,
        "last_name": null,
        "username": null,
        "message": "",
        "reply_to": null
    },
    {
        "message_id": 29355,
        "date": "2025-04-17 18:16:48",
        "sender_id": -1001484150043,
        "first_name": null,
        "last_name": null,
        "username": null,
        "message": "17.04.2025 Conference League.\nperformance Jagiellonia BiaÅ‚ystokğŸ‡µğŸ‡± against BetisğŸ‡ªğŸ‡¸",
        "reply_to": null
    },
    {
        "message_id": 29354,
        "date": "2025-04-17 17:48:46",
        "sender_id": -1001484150043,
        "first_name": null,
        "last_name": null,
        "username": null,
        "message": "",
        "reply_to": null
    },
    {
        "message_id": 29353,
        "date": "2025-04-17 17:48:46",
        "sender_id": -1001484150043,
        "first_name": null,
        "last_name": null,
        "username": null,
        "message": "17.04.2025 Europa League\nTottenhamğŸ´ó §ó ¢ó ¥ó ®ó §ó ¿ in FrankfurtğŸ‡©ğŸ‡ª",
        "reply_to": null
    },
    {
        "message_id": 29352,
        "date": "2025-04-17 13:20:41",
        "sender_id": -1001484150043,
        "first_name": null,
        "last_name": null,
        "username": null,
        "message": "",
        "reply_to": null
    },
    {
        "message_id": 29351,
        "date": "2025-04-17 13:20:40",
        "sender_id": -1001484150043,
        "first_name": null,
        "last_name": null,
        "username": null,
        "message": "13.04.2025 Switzerland ğŸ‡¨ğŸ‡­ \nChoreo Sion against Servette",
        "reply_to": null
    },
    {
        "message_id": 29350,
        "date": "2025-04-17 11:05:18",
        "sender_id": -1001484150043,
        "first_name": null,
        "last_name": null,
        "username": null,
        "message": "",
        "reply_to": null
    },
    {
        "message_id": 29349,
        "date": "2025-04-17 11:05:17",
        "sender_id": -1001484150043,
        "first_name": null,
        "last_name": null,
        "username": null,
        "message": "17.04.2025 Europa League.\nRangersğŸ´ó §ó ¢ó ³ó £ó ´ó ¿ graffiti away in BilbaoğŸ‡ªğŸ‡¸",
        "reply_to": null
    },
    {
        "message_id": 29348,
        "date": "2025-04-17 09:50:48",
        "sender_id": -1001484150043,
        "first_name": null,
        "last_name": null,
        "username": null,
        "message": "17.04.2025 Conference League.\nDjurgÃ¥rdenğŸ‡¸ğŸ‡ª ultras in WienğŸ‡¦ğŸ‡¹ last night (Rapid Wien against DjurgÃ¥rden)",
        "reply_to": null
    },
    {
        "message_id": 29347,
        "date": "2025-04-17 04:53:15",
        "sender_id": -1001484150043,
        "first_name": null,
        "last_name": null,
        "username": null,
        "message": "16.04.2025 GermanyğŸ‡©ğŸ‡ª Mittelreihn Pokal. Fortuna KÃ¶ln vs Alemannia Aachen",
        "reply_to": null
    },
    {
        "message_id": 29346,
        "date": "2025-04-16 21:30:24",
        "sender_id": -1001484150043,
        "first_name": null,
        "last_name": null,
        "username": null,
        "message": "",
        "reply_to": null
    },
    {
        "message_id": 29345,
        "date": "2025-04-16 21:30:24",
        "sender_id": -1001484150043,
        "first_name": null,
        "last_name": null,
        "username": null,
        "message": "",
        "reply_to": null
    },
    {
        "message_id": 29344,
        "date": "2025-04-16 21:30:23",
        "sender_id": -1001484150043,
        "first_name": null,
        "last_name": null,
        "username": null,
        "message": "",
        "reply_to": null
    },
    {
        "message_id": 29343,
        "date": "2025-04-16 21:30:23",
        "sender_id": -1001484150043,
        "first_name": null,
        "last_name": null,
        "username": null,
        "message": "16.04.2025 GermanyğŸ‡©ğŸ‡ª Mittelreihn Pokal. Fortuna KÃ¶ln vs Aachen",
        "reply_to": null
    },
    {
        "message_id": 29342,
        "date": "2025-04-16 20:31:23",
        "sender_id": -1001484150043,
        "first_name": null,
        "last_name": null,
        "username": null,
        "message": "16.04.2025 FranceğŸ‡«ğŸ‡· Basketball, Ğ¡hampion's League. Nanterre 92 (Paris) vs AEK AthensğŸ‡¬ğŸ‡·.\nUltras AEK (Original 21) ğŸ¤ Marseille in Paris. Big group Marseille +100 persons",
        "reply_to": null
    },
    {
        "message_id": 29341,
        "date": "2025-04-16 19:10:25",
        "sender_id": -1001484150043,
        "first_name": null,
        "last_name": null,
        "username": null,
        "message": "",
        "reply_to": null
    },
    {
        "message_id": 29340,
        "date": "2025-04-16 19:10:24",
        "sender_id": -1001484150043,
        "first_name": null,
        "last_name": null,
        "username": null,
        "message": "",
        "reply_to": null
    },
    {
        "message_id": 29339,
        "date": "2025-04-16 19:10:24",
        "sender_id": -1001484150043,
        "first_name": null,
        "last_name": null,
        "username": null,
        "message": "",
        "reply_to": null
    },
    {
        "message_id": 29338,
        "date": "2025-04-16 19:10:23",
        "sender_id": -1001484150043,
        "first_name": null,
        "last_name": null,
        "username": null,
        "message": "",
        "reply_to": null
    },
    {
        "message_id": 29337,
        "date": "2025-04-16 19:10:23",
        "sender_id": -1001484150043,
        "first_name": null,
        "last_name": null,
        "username": null,
        "message": "",
        "reply_to": null
    },
    {
        "message_id": 29336,
        "date": "2025-04-16 19:10:23",
        "sender_id": -1001484150043,
        "first_name": null,
        "last_name": null,
        "username": null,
        "message": "15.04.2025 Champions  League.\nBarcelona ğŸ‡ªğŸ‡¸ last night away against Borussia Dortmund ğŸ‡©ğŸ‡ª",
        "reply_to": null
    },
    {
        "message_id": 29335,
        "date": "2025-04-16 18:46:08",
        "sender_id": -1001484150043,
        "first_name": null,
        "last_name": null,
        "username": null,
        "message": "16.04.2025 Champions League.\n Inter MilanğŸ‡®ğŸ‡¹ â€“ Bayern MÃ¼nchenğŸ‡©ğŸ‡ª. Bayern fans before match",
        "reply_to": null
    },
    {
        "message_id": 29334,
        "date": "2025-04-16 12:16:57",
        "sender_id": -1001484150043,
        "first_name": null,
        "last_name": null,
        "username": null,
        "message": "",
        "reply_to": null
    },
    {
        "message_id": 29333,
        "date": "2025-04-16 12:16:57",
        "sender_id": -1001484150043,
        "first_name": null,
        "last_name": null,
        "username": null,
        "message": "",
        "reply_to": null
    },
    {
        "message_id": 29332,
        "date": "2025-04-16 12:16:56",
        "sender_id": -1001484150043,
        "first_name": null,
        "last_name": null,
        "username": null,
        "message": "",
        "reply_to": null
    },
    {
        "message_id": 29331,
        "date": "2025-04-16 12:16:56",
        "sender_id": -1001484150043,
        "first_name": null,
        "last_name": null,
        "username": null,
        "message": "",
        "reply_to": null
    },
    {
        "message_id": 29330,
        "date": "2025-04-16 12:16:56",
        "sender_id": -1001484150043,
        "first_name": null,
        "last_name": null,
        "username": null,
        "message": "13.04.2025 Germany ğŸ‡©ğŸ‡ª  3 league.\n3000 fans TSV 1860 MÃ¼nchen away  against  SV Waldhof Mannheim",
        "reply_to": null
    },
    {
        "message_id": 29329,
        "date": "2025-04-16 11:07:47",
        "sender_id": -1001484150043,
        "first_name": null,
        "last_name": null,
        "username": null,
        "message": "",
        "reply_to": 29258
    },
    {
        "message_id": 29328,
        "date": "2025-04-16 11:07:46",
        "sender_id": -1001484150043,
        "first_name": null,
        "last_name": null,
        "username": null,
        "message": "",
        "reply_to": 29258
    },
    {
        "message_id": 29327,
        "date": "2025-04-16 11:07:46",
        "sender_id": -1001484150043,
        "first_name": null,
        "last_name": null,
        "username": null,
        "message": "",
        "reply_to": 29258
    },
    {
        "message_id": 29326,
        "date": "2025-04-16 11:07:46",
        "sender_id": -1001484150043,
        "first_name": null,
        "last_name": null,
        "username": null,
        "message": "",
        "reply_to": 29258
    },
    {
        "message_id": 29325,
        "date": "2025-04-16 11:07:45",
        "sender_id": -1001484150043,
        "first_name": null,
        "last_name": null,
        "username": null,
        "message": "13.04.2025 Italy ğŸ‡®ğŸ‡¹ \nAftermath of Roma-Lazio clashes: 24 cops injured, 6 arrested, three rounds of away travel ban for both teams, the derby will no longer be played at night",
        "reply_to": 29258
    },
    {
        "message_id": 29324,
        "date": "2025-04-16 09:44:44",
        "sender_id": -1001484150043,
        "first_name": null,
        "last_name": null,
        "username": null,
        "message": "",
        "reply_to": null
    },
    {
        "message_id": 29323,
        "date": "2025-04-16 09:44:44",
        "sender_id": -1001484150043,
        "first_name": null,
        "last_name": null,
        "username": null,
        "message": "14.04.2025 Brazil ğŸ‡§ğŸ‡· \nTorcida Jovem do Santos celebrating Santos FC 113th aniversary in Santos city",
        "reply_to": null
    },
    {
        "message_id": 29322,
        "date": "2025-04-16 09:18:50",
        "sender_id": -1001484150043,
        "first_name": null,
        "last_name": null,
        "username": null,
        "message": "ğ—¢ğ—»ğ—¹ğ˜† ğ—”ğ—¿ğ—¿ğ—®ğ—»ğ—´ğ—² ğ—™ğ—¶ğ—´ğ•³ğ˜ ğŸŒ²ğŸ‘ŠğŸŒ²\n\nhttps://t.me/GruppaOF_arrangefight",
        "reply_to": null
    },
    {
        "message_id": 29321,
        "date": "2025-04-16 04:41:20",
        "sender_id": -1001484150043,
        "first_name": null,
        "last_name": null,
        "username": null,
        "message": "15.04.2025 Champions League.\nParis SGğŸ‡«ğŸ‡· away match against Aston VillağŸ´ó §ó ¢ó ¥ó ®ó §ó ¿.\nBirmingham City hooligans (Zulu Warriors) alongside PSG ultras",
        "reply_to": null
    },
    {
        "message_id": 29320,
        "date": "2025-04-15 20:07:57",
        "sender_id": -1001484150043,
        "first_name": null,
        "last_name": null,
        "username": null,
        "message": "",
        "reply_to": null
    },
    {
        "message_id": 29319,
        "date": "2025-04-15 20:07:57",
        "sender_id": -1001484150043,
        "first_name": null,
        "last_name": null,
        "username": null,
        "message": "",
        "reply_to": null
    },
    {
        "message_id": 29318,
        "date": "2025-04-15 20:07:56",
        "sender_id": -1001484150043,
        "first_name": null,
        "last_name": null,
        "username": null,
        "message": "",
        "reply_to": null
    },
    {
        "message_id": 29317,
        "date": "2025-04-15 20:07:56",
        "sender_id": -1001484150043,
        "first_name": null,
        "last_name": null,
        "username": null,
        "message": "15.04.2025 Champions League.\nBarcelonağŸ‡ªğŸ‡¸ fanmarch today in DortmundğŸ‡©ğŸ‡ª",
        "reply_to": null
    },
    {
        "message_id": 29315,
        "date": "2025-04-15 19:18:31",
        "sender_id": -1001484150043,
        "first_name": null,
        "last_name": null,
        "username": null,
        "message": "",
        "reply_to": null
    },
    {
        "message_id": 29314,
        "date": "2025-04-15 19:18:31",
        "sender_id": -1001484150043,
        "first_name": null,
        "last_name": null,
        "username": null,
        "message": "15.04.2025 Champions League.\n Paris SGğŸ‡«ğŸ‡· away match against Aston VillağŸ´ó §ó ¢ó ¥ó ®ó §ó ¿",
        "reply_to": null
    },
    {
        "message_id": 29313,
        "date": "2025-04-15 19:13:56",
        "sender_id": -1001484150043,
        "first_name": null,
        "last_name": null,
        "username": null,
        "message": "",
        "reply_to": null
    },
    {
        "message_id": 29312,
        "date": "2025-04-15 19:13:56",
        "sender_id": -1001484150043,
        "first_name": null,
        "last_name": null,
        "username": null,
        "message": "",
        "reply_to": null
    },
    {
        "message_id": 29311,
        "date": "2025-04-15 19:13:56",
        "sender_id": -1001484150043,
        "first_name": null,
        "last_name": null,
        "username": null,
        "message": "",
        "reply_to": null
    },
    {
        "message_id": 29310,
        "date": "2025-04-15 19:13:55",
        "sender_id": -1001484150043,
        "first_name": null,
        "last_name": null,
        "username": null,
        "message": "15.04.2025 Delije (Crvena ZvezdağŸ‡·ğŸ‡¸) in MÃ¼nchenğŸ‡©ğŸ‡ª before basketball match",
        "reply_to": null
    },
    {
        "message_id": 29309,
        "date": "2025-04-15 19:02:50",
        "sender_id": -1001484150043,
        "first_name": null,
        "last_name": null,
        "username": null,
        "message": "15.04.2025 Champions  League.\nPyro Barcelona ğŸ‡ªğŸ‡¸ away against\nBorussia Dortmund ğŸ‡©ğŸ‡ª",
        "reply_to": null
    },
    {
        "message_id": 29308,
        "date": "2025-04-15 17:59:18",
        "sender_id": -1001484150043,
        "first_name": null,
        "last_name": null,
        "username": null,
        "message": "",
        "reply_to": null
    },
    {
        "message_id": 29307,
        "date": "2025-04-15 17:59:17",
        "sender_id": -1001484150043,
        "first_name": null,
        "last_name": null,
        "username": null,
        "message": "",
        "reply_to": null
    },
    {
        "message_id": 29306,
        "date": "2025-04-15 17:59:17",
        "sender_id": -1001484150043,
        "first_name": null,
        "last_name": null,
        "username": null,
        "message": "15.04.2025 Bosnia ğŸ‡§ğŸ‡¦ \nBanja Luka vs FK Sarajevo today",
        "reply_to": null
    },
    {
        "message_id": 29305,
        "date": "2025-04-15 09:48:26",
        "sender_id": -1001484150043,
        "first_name": null,
        "last_name": null,
        "username": null,
        "message": "",
        "reply_to": null
    },
    {
        "message_id": 29304,
        "date": "2025-04-15 09:48:26",
        "sender_id": -1001484150043,
        "first_name": null,
        "last_name": null,
        "username": null,
        "message": "",
        "reply_to": null
    },
    {
        "message_id": 29303,
        "date": "2025-04-15 09:48:25",
        "sender_id": -1001484150043,
        "first_name": null,
        "last_name": null,
        "username": null,
        "message": "",
        "reply_to": null
    },
    {
        "message_id": 29302,
        "date": "2025-04-15 09:48:25",
        "sender_id": -1001484150043,
        "first_name": null,
        "last_name": null,
        "username": null,
        "message": "13.04.2025 France ğŸ‡«ğŸ‡·\nLyon 1950 away against Auxerre",
        "reply_to": null
    },
    {
        "message_id": 29301,
        "date": "2025-04-15 08:32:38",
        "sender_id": -1001484150043,
        "first_name": null,
        "last_name": null,
        "username": null,
        "message": "Ğ¥Ğ¥.Ğ¥Ğ¥.2025 Kazakhstan ğŸ‡°ğŸ‡¿ \nBasmachi + BSH + Verniy 70 (Kairat) vs West Wind (Aktobe). ~20x15. 1 min. Draw",
        "reply_to": null
    },
    {
        "message_id": 29299,
        "date": "2025-04-15 04:39:52",
        "sender_id": -1001484150043,
        "first_name": null,
        "last_name": null,
        "username": null,
        "message": "",
        "reply_to": null
    },
    {
        "message_id": 29298,
        "date": "2025-04-15 04:39:52",
        "sender_id": -1001484150043,
        "first_name": null,
        "last_name": null,
        "username": null,
        "message": "",
        "reply_to": null
    },
    {
        "message_id": 29297,
        "date": "2025-04-15 04:39:52",
        "sender_id": -1001484150043,
        "first_name": null,
        "last_name": null,
        "username": null,
        "message": "",
        "reply_to": null
    },
    {
        "message_id": 29296,
        "date": "2025-04-15 04:39:51",
        "sender_id": -1001484150043,
        "first_name": null,
        "last_name": null,
        "username": null,
        "message": "",
        "reply_to": null
    },
    {
        "message_id": 29295,
        "date": "2025-04-15 04:39:51",
        "sender_id": -1001484150043,
        "first_name": null,
        "last_name": null,
        "username": null,
        "message": "12.04.2025 France ğŸ‡«ğŸ‡· 2 league.\n 30 years KAOS ROUGE (Tribune Ouest Grenoble)",
        "reply_to": null
    },
    {
        "message_id": 29294,
        "date": "2025-04-14 20:34:44",
        "sender_id": -1001484150043,
        "first_name": null,
        "last_name": null,
        "username": null,
        "message": "14.04.2025 Champions League.\nParis SG (AuteuilğŸ‡¨ğŸ‡µ) present in BirminghamğŸ´ó §ó ¢ó ¥ó ®ó §ó ¿ before match against Aston Villa",
        "reply_to": null
    },
    {
        "message_id": 29293,
        "date": "2025-04-14 20:04:00",
        "sender_id": -1001484150043,
        "first_name": null,
        "last_name": null,
        "username": null,
        "message": "",
        "reply_to": null
    },
    {
        "message_id": 29292,
        "date": "2025-04-14 20:04:00",
        "sender_id": -1001484150043,
        "first_name": null,
        "last_name": null,
        "username": null,
        "message": "",
        "reply_to": null
    },
    {
        "message_id": 29291,
        "date": "2025-04-14 20:04:00",
        "sender_id": -1001484150043,
        "first_name": null,
        "last_name": null,
        "username": null,
        "message": "",
        "reply_to": null
    },
    {
        "message_id": 29290,
        "date": "2025-04-14 20:03:59",
        "sender_id": -1001484150043,
        "first_name": null,
        "last_name": null,
        "username": null,
        "message": "12.04.2025 Austria ğŸ‡¦ğŸ‡¹\nGrazer AK with choreography in a home match against Altach\n\nThe figure you see is Dionysus, the god of wine in Greek mythology, who represents freedom and celebration.\nA glass of wine in one hand, a football in the other, and a cigar in his mouth.\n\nHe is wearing a shirt with the clubâ€™s emblem, on which it says â€œ20 years.â€\nAt the center of the shirt, it says RED FIRM â€“ the name of the clubâ€™s ultra group, which is celebrating 20 years.\n(The Red Front).\n\nOn the banner below the figure it says: â€œDionysus loves us.â€\nAnd in the third image it says: â€œAnd we love the red.â€\n\nThe fourth and final image â€“ another choreography from the same match.\nA design that mimics an ancient Greek-Roman wall painting, with mythological scenes.\n\nAt the center of the choreography is the clubâ€™s emblem,\nand the year it was founded: 1902.\nNotice the wine jug, on which the founding year of the club â€“ 1902 â€“ is also engraved.",
        "reply_to": null
    },
    {
        "message_id": 29289,
        "date": "2025-04-14 13:16:15",
        "sender_id": -1001484150043,
        "first_name": null,
        "last_name": null,
        "username": null,
        "message": "",
        "reply_to": null
    },
    {
        "message_id": 29288,
        "date": "2025-04-14 13:16:15",
        "sender_id": -1001484150043,
        "first_name": null,
        "last_name": null,
        "username": null,
        "message": "12.04.2025 Poland ğŸ‡µğŸ‡± \nThe meeting between Korona Stuchowo and Sarmata Dobra was interrupted by the running onto the pitch of people claiming to be Debno Debno fans, who stole one of the flags, after which they began to beat up some of the football players",
        "reply_to": null
    },
    {
        "message_id": 29287,
        "date": "2025-04-14 13:00:56",
        "sender_id": -1001484150043,
        "first_name": null,
        "last_name": null,
        "username": null,
        "message": "",
        "reply_to": null
    },
    {
        "message_id": 29286,
        "date": "2025-04-14 13:00:56",
        "sender_id": -1001484150043,
        "first_name": null,
        "last_name": null,
        "username": null,
        "message": "",
        "reply_to": null
    },
    {
        "message_id": 29285,
        "date": "2025-04-14 13:00:55",
        "sender_id": -1001484150043,
        "first_name": null,
        "last_name": null,
        "username": null,
        "message": "",
        "reply_to": null
    },
    {
        "message_id": 29284,
        "date": "2025-04-14 13:00:55",
        "sender_id": -1001484150043,
        "first_name": null,
        "last_name": null,
        "username": null,
        "message": "13.04.2025 GermanyğŸ‡©ğŸ‡ª 9th League.\nDerby Reinsdorf vs Vorstraach \nğŸ“· SV Reinsdorf\n\nSupport local team ğŸ¤",
        "reply_to": null
    },
    {
        "message_id": 29283,
        "date": "2025-04-14 11:22:24",
        "sender_id": -1001484150043,
        "first_name": null,
        "last_name": null,
        "username": null,
        "message": "",
        "reply_to": null
    },
    {
        "message_id": 29282,
        "date": "2025-04-14 11:22:24",
        "sender_id": -1001484150043,
        "first_name": null,
        "last_name": null,
        "username": null,
        "message": "13.04.2025 Italy ğŸ‡®ğŸ‡¹\nInfo Roma: Roman fans seeking contact with Lazio fans 10 minutes of disorder between Roman fans and police and the Lazio fans didn't show up.\nInfo Lazio: Police block Lazio fans in bridge",
        "reply_to": null
    },
    {
        "message_id": 29281,
        "date": "2025-04-14 10:38:37",
        "sender_id": -1001484150043,
        "first_name": null,
        "last_name": null,
        "username": null,
        "message": "",
        "reply_to": null
    },
    {
        "message_id": 29280,
        "date": "2025-04-14 10:38:37",
        "sender_id": -1001484150043,
        "first_name": null,
        "last_name": null,
        "username": null,
        "message": "13.04.2025 Italy ğŸ‡®ğŸ‡¹ \nultras Lazio saying: â€œCurva Sud social media addictionâ€. Then you can see ultras Lazioâ€™s official Instagram page, full of photos from the DerbyğŸ¤·â€â™‚ï¸",
        "reply_to": null
    },
    {
        "message_id": 29279,
        "date": "2025-04-14 09:15:00",
        "sender_id": -1001484150043,
        "first_name": null,
        "last_name": null,
        "username": null,
        "message": "",
        "reply_to": null
    },
    {
        "message_id": 29278,
        "date": "2025-04-14 09:15:00",
        "sender_id": -1001484150043,
        "first_name": null,
        "last_name": null,
        "username": null,
        "message": "",
        "reply_to": null
    },
    {
        "message_id": 29277,
        "date": "2025-04-14 09:14:59",
        "sender_id": -1001484150043,
        "first_name": null,
        "last_name": null,
        "username": null,
        "message": "",
        "reply_to": null
    },
    {
        "message_id": 29276,
        "date": "2025-04-14 09:14:59",
        "sender_id": -1001484150043,
        "first_name": null,
        "last_name": null,
        "username": null,
        "message": "",
        "reply_to": null
    },
    {
        "message_id": 29275,
        "date": "2025-04-14 09:14:59",
        "sender_id": -1001484150043,
        "first_name": null,
        "last_name": null,
        "username": null,
        "message": "",
        "reply_to": null
    },
    {
        "message_id": 29274,
        "date": "2025-04-14 09:14:58",
        "sender_id": -1001484150043,
        "first_name": null,
        "last_name": null,
        "username": null,
        "message": "12.04.2025 Belgium ğŸ‡§ğŸ‡ª 20 years Brussels Power 2005 (ultras RWDM)\n\npyroğŸ”¥ https://t.me/gruppaof_canal",
        "reply_to": null
    },
    {
        "message_id": 29273,
        "date": "2025-04-14 05:55:06",
        "sender_id": -1001484150043,
        "first_name": null,
        "last_name": null,
        "username": null,
        "message": "12.04.2025 Switzerland ğŸ‡¨ğŸ‡­ Street fight.\nultras Basel vs FC Zurich. 50x50. Win. Basel",
        "reply_to": null
    },
    {
        "message_id": 29272,
        "date": "2025-04-14 04:32:48",
        "sender_id": -1001484150043,
        "first_name": null,
        "last_name": null,
        "username": null,
        "message": "",
        "reply_to": null
    },
    {
        "message_id": 29271,
        "date": "2025-04-14 04:32:48",
        "sender_id": -1001484150043,
        "first_name": null,
        "last_name": null,
        "username": null,
        "message": "",
        "reply_to": null
    },
    {
        "message_id": 29270,
        "date": "2025-04-14 04:32:47",
        "sender_id": -1001484150043,
        "first_name": null,
        "last_name": null,
        "username": null,
        "message": "13.04.2025 Germany ğŸ‡©ğŸ‡ªHeidenheim Ğ°way in Frankfurt with a Ñhoreo.",
        "reply_to": null
    },
    {
        "message_id": 29269,
        "date": "2025-04-13 21:04:47",
        "sender_id": -1001484150043,
        "first_name": null,
        "last_name": null,
        "username": null,
        "message": "13.04.2025 Denmark ğŸ‡©ğŸ‡°\nKÃ¸benhavn vs Brondby",
        "reply_to": 29252
    },
    {
        "message_id": 29268,
        "date": "2025-04-13 20:57:32",
        "sender_id": -1001484150043,
        "first_name": null,
        "last_name": null,
        "username": null,
        "message": "XX.04.2025 FranceğŸ‡«ğŸ‡· Arrange  fight. \nLyon 1919 (red) vs Auxerre (white). 10x10. 15 sec. Win. Lyon",
        "reply_to": null
    },
    {
        "message_id": 29267,
        "date": "2025-04-13 20:54:00",
        "sender_id": -1001484150043,
        "first_name": null,
        "last_name": null,
        "username": null,
        "message": "",
        "reply_to": null
    },
    {
        "message_id": 29266,
        "date": "2025-04-13 20:53:59",
        "sender_id": -1001484150043,
        "first_name": null,
        "last_name": null,
        "username": null,
        "message": "XX.04.2025 FranceğŸ‡«ğŸ‡· Arrange  fight. \nLyon 1919 vs Auxerre. 10x10. 15 sec. Win. Lyon",
        "reply_to": null
    },
    {
        "message_id": 29265,
        "date": "2025-04-13 20:47:09",
        "sender_id": -1001484150043,
        "first_name": null,
        "last_name": null,
        "username": null,
        "message": "",
        "reply_to": null
    },
    {
        "message_id": 29264,
        "date": "2025-04-13 20:47:09",
        "sender_id": -1001484150043,
        "first_name": null,
        "last_name": null,
        "username": null,
        "message": "",
        "reply_to": null
    },
    {
        "message_id": 29263,
        "date": "2025-04-13 20:47:09",
        "sender_id": -1001484150043,
        "first_name": null,
        "last_name": null,
        "username": null,
        "message": "13.04.2025 Italy ğŸ‡®ğŸ‡¹ \nDerby SS Lazio against AS Roma.",
        "reply_to": null
    },
    {
        "message_id": 29262,
        "date": "2025-04-13 18:52:00",
        "sender_id": -1001484150043,
        "first_name": null,
        "last_name": null,
        "username": null,
        "message": "",
        "reply_to": null
    },
    {
        "message_id": 29261,
        "date": "2025-04-13 18:52:00",
        "sender_id": -1001484150043,
        "first_name": null,
        "last_name": null,
        "username": null,
        "message": "",
        "reply_to": null
    },
    {
        "message_id": 29260,
        "date": "2025-04-13 18:51:59",
        "sender_id": -1001484150043,
        "first_name": null,
        "last_name": null,
        "username": null,
        "message": "13.04.2025 Sweden ğŸ‡¸ğŸ‡ª \nDjurgÃ¥rdens IF tifo agianst Hammarby IF today, derby in Allsvenskan",
        "reply_to": null
    },
    {
        "message_id": 29259,
        "date": "2025-04-13 18:07:49",
        "sender_id": -1001484150043,
        "first_name": null,
        "last_name": null,
        "username": null,
        "message": "13.04.2025 Italy ğŸ‡®ğŸ‡¹ \nDerby SS Lazio against AS Roma.",
        "reply_to": null
    },
    {
        "message_id": 29258,
        "date": "2025-04-13 16:45:35",
        "sender_id": -1001484150043,
        "first_name": null,
        "last_name": null,
        "username": null,
        "message": "13.04.2025 Italy ğŸ‡®ğŸ‡¹ \nRome in the Lazio area",
        "reply_to": null
    },
    {
        "message_id": 29257,
        "date": "2025-04-13 16:44:56",
        "sender_id": -1001484150043,
        "first_name": null,
        "last_name": null,
        "username": null,
        "message": "13.04.2025 Denmark ğŸ‡©ğŸ‡° \nBrÃ¸ndby fans after derby win. (No BrÃ¸ndby fans allowed/banner from stadium)",
        "reply_to": null
    },
    {
        "message_id": 29256,
        "date": "2025-04-13 16:23:52",
        "sender_id": -1001484150043,
        "first_name": null,
        "last_name": null,
        "username": null,
        "message": "13.04.2025 Italy ğŸ‡®ğŸ‡¹\nDerby Lazio - Roma. Lazio vs 1312",
        "reply_to": null
    },
    {
        "message_id": 29255,
        "date": "2025-04-13 15:38:49",
        "sender_id": -1001484150043,
        "first_name": null,
        "last_name": null,
        "username": null,
        "message": "13.04.2025 Germany ğŸ‡©ğŸ‡ª \nDortmund vs Cottbus",
        "reply_to": null
    },
    {
        "message_id": 29254,
        "date": "2025-04-13 14:46:11",
        "sender_id": -1001484150043,
        "first_name": null,
        "last_name": null,
        "username": null,
        "message": "",
        "reply_to": null
    },
    {
        "message_id": 29253,
        "date": "2025-04-13 14:46:10",
        "sender_id": -1001484150043,
        "first_name": null,
        "last_name": null,
        "username": null,
        "message": "13.04.2025 Kazakhstan ğŸ‡°ğŸ‡¿ Arrange fight. CIT ULTRAS (Ordabasy) vs VERNIY 70 (Kairat). 7x7. 40 sec. Win Verniy",
        "reply_to": null
    },
    {
        "message_id": 29252,
        "date": "2025-04-13 14:32:45",
        "sender_id": -1001484150043,
        "first_name": null,
        "last_name": null,
        "username": null,
        "message": "13.04.2025 Denmark ğŸ‡©ğŸ‡°\nKÃ¸benhavn vs Brondby",
        "reply_to": null
    },
    {
        "message_id": 29251,
        "date": "2025-04-13 10:27:48",
        "sender_id": -1001484150043,
        "first_name": null,
        "last_name": null,
        "username": null,
        "message": "13.04.2025 Italy ğŸ‡®ğŸ‡¹ \nultras lazio at Ponte Milvio",
        "reply_to": null
    },
    {
        "message_id": 29250,
        "date": "2025-04-13 09:54:00",
        "sender_id": -1001484150043,
        "first_name": null,
        "last_name": null,
        "username": null,
        "message": "",
        "reply_to": null
    },
    {
        "message_id": 29249,
        "date": "2025-04-13 09:54:00",
        "sender_id": -1001484150043,
        "first_name": null,
        "last_name": null,
        "username": null,
        "message": "13.04.2025 Italy ğŸ‡®ğŸ‡¹ \nultras lazio at Ponte Milvio",
        "reply_to": null
    },
    {
        "message_id": 29248,
        "date": "2025-04-13 09:49:57",
        "sender_id": -1001484150043,
        "first_name": null,
        "last_name": null,
        "username": null,
        "message": "",
        "reply_to": null
    },
    {
        "message_id": 29247,
        "date": "2025-04-13 09:49:57",
        "sender_id": -1001484150043,
        "first_name": null,
        "last_name": null,
        "username": null,
        "message": "12.04.2025 Switzerland ğŸ‡¨ğŸ‡­ \nFC Basel away against FC ZÃ¼rich",
        "reply_to": null
    },
    {
        "message_id": 29246,
        "date": "2025-04-13 09:21:13",
        "sender_id": -1001484150043,
        "first_name": null,
        "last_name": null,
        "username": null,
        "message": "10.04.2025 Europa League.\nRangersğŸ´ó §ó ¢ó ³ó £ó ´ó ¿ - Athletic BilbaoğŸ‡ªğŸ‡¸\nBilbao ğŸ¤ Celtic",
        "reply_to": null
    },
    {
        "message_id": 29245,
        "date": "2025-04-13 08:51:16",
        "sender_id": -1001484150043,
        "first_name": null,
        "last_name": null,
        "username": null,
        "message": "12.04.2025 Finland ğŸ‡«ğŸ‡®\nPelicans-Jokerit. BCC+LYC attacked Jokerit after match. Short fight. Win 1312",
        "reply_to": null
    },
    {
        "message_id": 29244,
        "date": "2025-04-13 08:34:43",
        "sender_id": -1001484150043,
        "first_name": null,
        "last_name": null,
        "username": null,
        "message": "13.04.2025 DenmarkğŸ‡©ğŸ‡°\nBrÃ¸ndby before derby against Copenhagen",
        "reply_to": null
    },
    {
        "message_id": 29243,
        "date": "2025-04-12 20:46:03",
        "sender_id": -1001484150043,
        "first_name": null,
        "last_name": null,
        "username": null,
        "message": "12.04.2025 Switzerland ğŸ‡¨ğŸ‡­ \nFC Basel away against FC ZÃ¼rich",
        "reply_to": null
    },
    {
        "message_id": 29242,
        "date": "2025-04-12 20:42:30",
        "sender_id": -1001484150043,
        "first_name": null,
        "last_name": null,
        "username": null,
        "message": "",
        "reply_to": null
    },
    {
        "message_id": 29241,
        "date": "2025-04-12 20:42:30",
        "sender_id": -1001484150043,
        "first_name": null,
        "last_name": null,
        "username": null,
        "message": "12.04.2025 Switzerland ğŸ‡¨ğŸ‡­ \nFC ZÃ¼rich at home against FC Basel",
        "reply_to": null
    },
    {
        "message_id": 29240,
        "date": "2025-04-12 20:33:48",
        "sender_id": -1001484150043,
        "first_name": null,
        "last_name": null,
        "username": null,
        "message": "",
        "reply_to": null
    },
    {
        "message_id": 29239,
        "date": "2025-04-12 20:33:48",
        "sender_id": -1001484150043,
        "first_name": null,
        "last_name": null,
        "username": null,
        "message": "12.04.2025 Switzerland ğŸ‡¨ğŸ‡­ \n20 years friendship Lausanne ğŸ¤ Winterthur",
        "reply_to": null
    },
    {
        "message_id": 29238,
        "date": "2025-04-12 19:04:51",
        "sender_id": -1001484150043,
        "first_name": null,
        "last_name": null,
        "username": null,
        "message": "",
        "reply_to": null
    },
    {
        "message_id": 29237,
        "date": "2025-04-12 19:04:51",
        "sender_id": -1001484150043,
        "first_name": null,
        "last_name": null,
        "username": null,
        "message": "12.04.2025 Germany ğŸ‡©ğŸ‡ª  2 league.\nKaiserslautern against NÃ¼rnberg.\nChoreo Kaiserslautern",
        "reply_to": null
    },
    {
        "message_id": 29236,
        "date": "2025-04-12 18:47:37",
        "sender_id": -1001484150043,
        "first_name": null,
        "last_name": null,
        "username": null,
        "message": "",
        "reply_to": null
    },
    {
        "message_id": 29235,
        "date": "2025-04-12 18:47:36",
        "sender_id": -1001484150043,
        "first_name": null,
        "last_name": null,
        "username": null,
        "message": "",
        "reply_to": null
    },
    {
        "message_id": 29234,
        "date": "2025-04-12 18:47:36",
        "sender_id": -1001484150043,
        "first_name": null,
        "last_name": null,
        "username": null,
        "message": "",
        "reply_to": null
    },
    {
        "message_id": 29233,
        "date": "2025-04-12 18:47:35",
        "sender_id": -1001484150043,
        "first_name": null,
        "last_name": null,
        "username": null,
        "message": "",
        "reply_to": null
    },
    {
        "message_id": 29232,
        "date": "2025-04-12 18:47:35",
        "sender_id": -1001484150043,
        "first_name": null,
        "last_name": null,
        "username": null,
        "message": "",
        "reply_to": null
    },
    {
        "message_id": 29231,
        "date": "2025-04-12 18:47:35",
        "sender_id": -1001484150043,
        "first_name": null,
        "last_name": null,
        "username": null,
        "message": "",
        "reply_to": null
    },
    {
        "message_id": 29230,
        "date": "2025-04-12 18:47:34",
        "sender_id": -1001484150043,
        "first_name": null,
        "last_name": null,
        "username": null,
        "message": "12.04.2025 Serbia ğŸ‡·ğŸ‡¸\nCrvena Zvezda against Partizan",
        "reply_to": null
    },
    {
        "message_id": 29229,
        "date": "2025-04-12 14:02:57",
        "sender_id": -1001484150043,
        "first_name": null,
        "last_name": null,
        "username": null,
        "message": "Ğ¥Ğ¥.03.2025 Poland ğŸ‡µğŸ‡±  Arrange fight, U26.\nStilon GorzÃ³w vs Zawisza Bydgoszcz. 10x10. 2,10 win. Win. Stilon",
        "reply_to": null
    },
    {
        "message_id": 29228,
        "date": "2025-04-12 12:39:02",
        "sender_id": -1001484150043,
        "first_name": null,
        "last_name": null,
        "username": null,
        "message": "",
        "reply_to": null
    },
    {
        "message_id": 29227,
        "date": "2025-04-12 12:39:02",
        "sender_id": -1001484150043,
        "first_name": null,
        "last_name": null,
        "username": null,
        "message": "",
        "reply_to": null
    },
    {
        "message_id": 29226,
        "date": "2025-04-12 12:39:00",
        "sender_id": -1001484150043,
        "first_name": null,
        "last_name": null,
        "username": null,
        "message": "12.04.2025 Germany ğŸ‡©ğŸ‡ª 2 league.\nMagdeburg in Ulm",
        "reply_to": null
    },
    {
        "message_id": 29225,
        "date": "2025-04-12 07:30:20",
        "sender_id": -1001484150043,
        "first_name": null,
        "last_name": null,
        "username": null,
        "message": "",
        "reply_to": null
    },
    {
        "message_id": 29224,
        "date": "2025-04-12 07:30:19",
        "sender_id": -1001484150043,
        "first_name": null,
        "last_name": null,
        "username": null,
        "message": "",
        "reply_to": null
    },
    {
        "message_id": 29223,
        "date": "2025-04-12 07:30:19",
        "sender_id": -1001484150043,
        "first_name": null,
        "last_name": null,
        "username": null,
        "message": "",
        "reply_to": null
    },
    {
        "message_id": 29222,
        "date": "2025-04-12 07:30:19",
        "sender_id": -1001484150043,
        "first_name": null,
        "last_name": null,
        "username": null,
        "message": "11.04.2025 Spain ğŸ‡ªğŸ‡¸ \nYomus (Valencia) match against Sevilla",
        "reply_to": null
    },
    {
        "message_id": 29221,
        "date": "2025-04-12 05:37:11",
        "sender_id": -1001484150043,
        "first_name": null,
        "last_name": null,
        "username": null,
        "message": "ğ•²ğ–—ğ–šğ–•ğ–•ğ–†ğ•ºğ•± ğ–‹ğ–”ğ–— ğ–†ğ–“ ğ–†ğ–ˆğ–™ğ–ğ–›ğ–Š ğ–œğ–Šğ–Šğ–ğ–Šğ–“ğ–‰ğŸŒ²ğŸ‘ŠğŸŒ²",
        "reply_to": null
    },
    {
        "message_id": 29220,
        "date": "2025-04-11 20:49:03",
        "sender_id": -1001484150043,
        "first_name": null,
        "last_name": null,
        "username": null,
        "message": "11.04.2025 NetherlandsğŸ‡³ğŸ‡± 2 League.\nADO Den Haag vs Telstar",
        "reply_to": null
    },
    {
        "message_id": 29219,
        "date": "2025-04-11 19:50:42",
        "sender_id": -1001484150043,
        "first_name": null,
        "last_name": null,
        "username": null,
        "message": "",
        "reply_to": null
    },
    {
        "message_id": 29218,
        "date": "2025-04-11 19:50:41",
        "sender_id": -1001484150043,
        "first_name": null,
        "last_name": null,
        "username": null,
        "message": "",
        "reply_to": null
    },
    {
        "message_id": 29217,
        "date": "2025-04-11 19:50:41",
        "sender_id": -1001484150043,
        "first_name": null,
        "last_name": null,
        "username": null,
        "message": "11.04.2025 NetherlandsğŸ‡³ğŸ‡± 2 League.\nDe Graafschap away at FC Eindhoven\n\npyroğŸ”¥ https://t.me/gruppaof_canal",
        "reply_to": null
    },
    {
        "message_id": 29216,
        "date": "2025-04-11 17:09:01",
        "sender_id": -1001484150043,
        "first_name": null,
        "last_name": null,
        "username": null,
        "message": "11.04.2025 GermanyğŸ‡©ğŸ‡ª 2 league.\nHamburger SV against Eintracht Braunschweig",
        "reply_to": null
    },
    {
        "message_id": 29215,
        "date": "2025-04-11 16:38:37",
        "sender_id": -1001484150043,
        "first_name": null,
        "last_name": null,
        "username": null,
        "message": "11.04.2025 Italy ğŸ‡®ğŸ‡¹ \nultras Lazio already in Stadio Olimpico preparing the choreo for Lazio-Roma. The match is on sunday.",
        "reply_to": null
    },
    {
        "message_id": 29214,
        "date": "2025-04-11 16:15:40",
        "sender_id": -1001484150043,
        "first_name": null,
        "last_name": null,
        "username": null,
        "message": "11.04.2025 Denmark ğŸ‡©ğŸ‡° \nOdense on their way to Esbjerg today",
        "reply_to": null
    },
    {
        "message_id": 29213,
        "date": "2025-04-11 13:38:36",
        "sender_id": -1001484150043,
        "first_name": null,
        "last_name": null,
        "username": null,
        "message": "",
        "reply_to": null
    },
    {
        "message_id": 29212,
        "date": "2025-04-11 13:38:35",
        "sender_id": -1001484150043,
        "first_name": null,
        "last_name": null,
        "username": null,
        "message": "",
        "reply_to": null
    },
    {
        "message_id": 29211,
        "date": "2025-04-11 13:38:35",
        "sender_id": -1001484150043,
        "first_name": null,
        "last_name": null,
        "username": null,
        "message": "10.04.2025 Europa League.\nperformance RangersğŸ´ó §ó ¢ó ³ó £ó ´ó ¿ - Athletic BilbaoğŸ‡ªğŸ‡¸",
        "reply_to": null
    },
    {
        "message_id": 29210,
        "date": "2025-04-11 12:03:37",
        "sender_id": -1001484150043,
        "first_name": null,
        "last_name": null,
        "username": null,
        "message": "",
        "reply_to": 29204
    },
    {
        "message_id": 29209,
        "date": "2025-04-11 12:03:37",
        "sender_id": -1001484150043,
        "first_name": null,
        "last_name": null,
        "username": null,
        "message": "10.04.2025 Conference League.\nHammarby ultras together with lords RapidğŸ‡¦ğŸ‡¹ against Djurgarden in StockholmğŸ‡¸ğŸ‡ª",
        "reply_to": 29204
    },
    {
        "message_id": 29208,
        "date": "2025-04-11 10:28:14",
        "sender_id": -1001484150043,
        "first_name": null,
        "last_name": null,
        "username": null,
        "message": "",
        "reply_to": null
    },
    {
        "message_id": 29207,
        "date": "2025-04-11 10:28:14",
        "sender_id": -1001484150043,
        "first_name": null,
        "last_name": null,
        "username": null,
        "message": "10.04.2025 Conference League.\n FiorentinağŸ‡®ğŸ‡¹ away match against NK CeljeğŸ‡¸ğŸ‡®",
        "reply_to": null
    },
    {
        "message_id": 29206,
        "date": "2025-04-11 10:11:32",
        "sender_id": -1001484150043,
        "first_name": null,
        "last_name": null,
        "username": null,
        "message": "",
        "reply_to": null
    },
    {
        "message_id": 29205,
        "date": "2025-04-11 10:11:32",
        "sender_id": -1001484150043,
        "first_name": null,
        "last_name": null,
        "username": null,
        "message": "",
        "reply_to": null
    },
    {
        "message_id": 29204,
        "date": "2025-04-11 10:11:31",
        "sender_id": -1001484150043,
        "first_name": null,
        "last_name": null,
        "username": null,
        "message": "10.04.2025 Conference League.\nRapid WienğŸ‡¦ğŸ‡¹ away against DjurgÃ¥rdenğŸ‡¸ğŸ‡ª",
        "reply_to": null
    },
    {
        "message_id": 29201,
        "date": "2025-04-11 04:35:33",
        "sender_id": -1001484150043,
        "first_name": null,
        "last_name": null,
        "username": null,
        "message": "10.04.2025 Europa League.\nRangersğŸ´ó §ó ¢ó ³ó £ó ´ó ¿ - Athletic BilbaoğŸ‡ªğŸ‡¸\nInfo Rangers: Bilbao arrive at a closed pub at 00:05 am on Thursday when the Pub is closed and pose for pictures without making any contact with any group at Rangers.",
        "reply_to": 29197
    },
    {
        "message_id": 29200,
        "date": "2025-04-10 21:21:58",
        "sender_id": -1001484150043,
        "first_name": null,
        "last_name": null,
        "username": null,
        "message": "10.04.2025 Conference League.\nBetisğŸ‡ªğŸ‡¸ - JagielloniağŸ‡µğŸ‡±. \nJagiellonia vs 1312. Win. Jagiellonia",
        "reply_to": null
    },
    {
        "message_id": 29199,
        "date": "2025-04-10 20:21:05",
        "sender_id": -1001484150043,
        "first_name": null,
        "last_name": null,
        "username": null,
        "message": "10.04.2025 Europa League.\nEintracht FrankfurtğŸ‡©ğŸ‡ª chorteo in London against Tottenham HotspurğŸ´ó §ó ¢ó ¥ó ®ó §ó ¿",
        "reply_to": null
    },
    {
        "message_id": 29198,
        "date": "2025-04-10 19:58:16",
        "sender_id": -1001484150043,
        "first_name": null,
        "last_name": null,
        "username": null,
        "message": "10.04.2025 Europa League.\nRangersğŸ´ó §ó ¢ó ³ó £ó ´ó ¿ - Athletic BilbaoğŸ‡ªğŸ‡¸\nInfo Athletic: Wednesday afternoon and evening herri norte looking for the Glasgow boys. When they didn't show up, we decided to go to their pub and decorate it.",
        "reply_to": 29197
    },
    {
        "message_id": 29197,
        "date": "2025-04-10 19:54:23",
        "sender_id": -1001484150043,
        "first_name": null,
        "last_name": null,
        "username": null,
        "message": "10.04.2025 Europa League.\nRangersğŸ´ó §ó ¢ó ³ó £ó ´ó ¿ - Athletic BilbaoğŸ‡ªğŸ‡¸\nInfo Athletic: Wednesday afternoon and evening herri norte looking for the Glasgow boys. When they didn't show up, we decided to go to their pub and decorate it.",
        "reply_to": null
    },
    {
        "message_id": 29196,
        "date": "2025-04-10 19:14:04",
        "sender_id": -1001484150043,
        "first_name": null,
        "last_name": null,
        "username": null,
        "message": "10.04.2025 Europa League.\nEintracht FrankfurtğŸ‡©ğŸ‡ª in London against Tottenham HotspurğŸ´ó §ó ¢ó ¥ó ®ó §ó ¿",
        "reply_to": null
    },
    {
        "message_id": 29195,
        "date": "2025-04-10 18:44:29",
        "sender_id": -1001484150043,
        "first_name": null,
        "last_name": null,
        "username": null,
        "message": "10.04.2025 Conference League.\nBetisğŸ‡ªğŸ‡¸ - JagielloniağŸ‡µğŸ‡±. Jagiellonia vs 1312",
        "reply_to": null
    },
    {
        "message_id": 29194,
        "date": "2025-04-10 18:39:06",
        "sender_id": -1001484150043,
        "first_name": null,
        "last_name": null,
        "username": null,
        "message": "",
        "reply_to": null
    },
    {
        "message_id": 29193,
        "date": "2025-04-10 18:39:05",
        "sender_id": -1001484150043,
        "first_name": null,
        "last_name": null,
        "username": null,
        "message": "",
        "reply_to": null
    },
    {
        "message_id": 29192,
        "date": "2025-04-10 18:39:05",
        "sender_id": -1001484150043,
        "first_name": null,
        "last_name": null,
        "username": null,
        "message": "10.04.2025 Europa League.\nRangersğŸ´ó §ó ¢ó ³ó £ó ´ó ¿ before BilbaoğŸ‡ªğŸ‡¸",
        "reply_to": null
    },
    {
        "message_id": 29191,
        "date": "2025-04-10 17:41:54",
        "sender_id": -1001484150043,
        "first_name": null,
        "last_name": null,
        "username": null,
        "message": "",
        "reply_to": null
    },
    {
        "message_id": 29190,
        "date": "2025-04-10 17:41:54",
        "sender_id": -1001484150043,
        "first_name": null,
        "last_name": null,
        "username": null,
        "message": "",
        "reply_to": null
    },
    {
        "message_id": 29189,
        "date": "2025-04-10 17:41:53",
        "sender_id": -1001484150043,
        "first_name": null,
        "last_name": null,
        "username": null,
        "message": "",
        "reply_to": null
    },
    {
        "message_id": 29188,
